Title,Year,Rated,Released,Runtime,Genre,Director,Writer,Actors,Plot,Language,Country,Awards,Poster,Ratings,Metascore,imdbRating,imdbVotes,imdbID,Type,DVD,BoxOffice,Production,Website,Response,totalSeasons
Screenplay Movie: Blood Ties,2021,N/A,06 Dec 2021,2 min,"Short, Crime",Matthew Toffolo,JoAnne Myers,Allan Michael Brunet,Assistant Prosecutor Audra Roper solves her identical sisters murder with psychic visions.,English,United States,N/A,N/A,[],N/A,N/A,N/A,tt16356500,movie,N/A,N/A,N/A,N/A,True,
Screenplay Movie: Two Women,2021,N/A,06 Dec 2021,6 min,"Short, Family, Fantasy",Matthew Toffolo,"Ken White, Ken White","Sean Ballantyne, Elizabeth Rose Morriss, Kyana Teresa",Maria and her daughter Stephanie have a heart to heart conversation. There is a mysterious twist that changes their relationship forever.,English,United States,N/A,N/A,[],N/A,N/A,N/A,tt16356626,movie,N/A,N/A,N/A,N/A,True,
Movie Buffs,2021–,N/A,25 Aug 2021,N/A,Comedy,N/A,N/A,"Brandt Goodman, Daniel Vigil, Raegan Lomanto",N/A,English,United States,N/A,https://m.media-amazon.com/images/M/MV5BM2Y2OTM2YmEtYWU3Mi00ZDAxLWJkMmYtZTAwMTdlYzhhYzEzXkEyXkFqcGdeQXVyMzY4NDk0MTg@._V1_SX300.jpg,[],N/A,N/A,N/A,tt16369232,series,,,,,True,N/A
The Prank Movie Human Parts Saga,2021,N/A,16 Apr 2021,71 min,Comedy,McMakopolo,McMakopolo,"Akindoju April, Tersoo Doris, Chigan Madu",Mc Makopolo uses beautiful ladies to lure men into believing they found a ready made relationship that beats their imagination and then went on to call for a movie audition that was well staged by his partner Chigan Madu that ended a,English,Nigeria,N/A,https://m.media-amazon.com/images/M/MV5BOGMzZDljMGQtMzMxMS00NGU2LTkwMzktNTllMThiMDkyNDRmXkEyXkFqcGdeQXVyMTQ2NzA1NDA4._V1_SX300.jpg,[],N/A,N/A,N/A,tt16384078,movie,N/A,N/A,N/A,N/A,True,
Movies with James Movie Reviews,2021–,N/A,06 Apr 2021,N/A,"Documentary, Talk-Show",N/A,N/A,N/A,Youtuber James Ash (Movies with James) reviews and revisits movies.,English,United Kingdom,N/A,N/A,[],N/A,N/A,N/A,tt16400848,series,,,,,True,N/A
The Biker Movie,2021,N/A,25 Nov 2021,N/A,Documentary,Pete Alva,Pete Alva,"Paul Renteria, Pat Savage, Oliver Shokouh",USA Biker Events filmed over the last 14 years,English,United States,N/A,https://m.media-amazon.com/images/M/MV5BZjU4OWJkNTctNDE5NC00NTIwLWJjMGYtZjdjYTc1YTQ5NzMyXkEyXkFqcGdeQXVyMTc3NTczMw@@._V1_SX300.jpg,[],N/A,N/A,N/A,tt16420054,movie,N/A,N/A,N/A,N/A,True,
Mankai Movie 'A3!' -Spring & Summer-,2021,N/A,03 Dec 2021,116 min,"Comedy, Drama, Musical",Kenji Qurata,Kenji Qurata,Ryûgi Yokota,"""Director. Please make our talent blossom!"" Veludo, a suburb of Tokyo, is a mecca for actors and home to many theatre companies along its famous Veludo Way. The film audience's point of view will overlap with that of the female PO...",Japanese,Japan,N/A,https://m.media-amazon.com/images/M/MV5BYTE2ODI5YjYtM2M0Ny00NGU3LWI3NDMtNDhlYzRmZmM2ZDQ4XkEyXkFqcGdeQXVyMzEzMzY3Ng@@._V1_SX300.jpg,[],N/A,N/A,N/A,tt16427414,movie,N/A,N/A,N/A,N/A,True,
"Senseless, the Movie 2021",2021,N/A,25 Nov 2021,72 min,Drama,N/A,Kathy Smith,"ChiffonaRay, Robert Malloy, Boyzie Lee Mathis","When star basketball player Lil J decides he's not going to play ball his senior year of high school, but instead, he'd rather run the streets with gangbangers selling drugs to earn a living. His mother Toya, Grandma Ella, best fr...",English,United States,N/A,https://m.media-amazon.com/images/M/MV5BNTMxNGJmZGQtODA2MS00YzUyLTgwYTgtYzNmZmI5ZDI3OTdhXkEyXkFqcGdeQXVyNTA4NzQxMzY@._V1_SX300.jpg,[],N/A,N/A,N/A,tt16124436,movie,N/A,N/A,N/A,N/A,True,
Saw: A Roblox Movie,2021,N/A,21 Nov 2021,27 min,"Short, Horror",Jip Kared,N/A,"Soap, Tyler Monkey, Synd Roomco","A confused Eddie, Abra and Synd wake up in a bathroom, not knowing where they are, the 3 decide to roam around the place to see what is going on. As they escape they get put trough a series of tests where they would have to hurt t...",N/A,United States,N/A,https://m.media-amazon.com/images/M/MV5BMGViOTM3YTEtNzdmMi00MjZhLWFkYjgtOTk2NDM4MDIxMGMzXkEyXkFqcGc@._V1_SX300.jpg,[],N/A,N/A,N/A,tt16193590,movie,N/A,N/A,N/A,N/A,True,
The Mescal Movie Set: Behind the Scenes of Iconic Westerns,2021,N/A,16 Nov 2021,10 min,"Documentary, Short",Christy Oldham,N/A,N/A,N/A,English,United States,N/A,https://m.media-amazon.com/images/M/MV5BMTdmZDVkNzItYjhlOS00ZDRkLThlNzMtNWM4MTczNDVhOTRhXkEyXkFqcGdeQXVyMzEyMjc3Mg@@._V1_SX300.jpg,[],N/A,N/A,N/A,tt16257326,movie,N/A,N/A,N/A,N/A,True,
Transformers Big Motion Movie,2021,N/A,23 Dec 2021,86 min,Fantasy,Walter Monnar,Walter Monnar,N/A,"A Big Star, A Big Revenge and A Big Motion Picture to Save the day. TRANS, Zoomer and Wheels are Inviting All Characters to the party Meanwhile SHRANS Is Planning to Get Revenge on TRANS and His Brothers. Can TRANS Stop SHRANS Before",English,United States,N/A,N/A,[],N/A,N/A,N/A,tt16578864,movie,N/A,N/A,N/A,N/A,True,
The Last Survival (Movie),2021,N/A,25 Jun 2021,31 min,"Short, Adventure",Daniel Munoz,Joel Munoz Alonso,N/A,So in this Movie there about dozen of Godzillas trying to survive they were the last to survive and to survive they need to get the crystal but there are other characters trying to stop them will they stop them or they will surviv...,English,N/A,N/A,N/A,[],N/A,N/A,N/A,tt16711446,movie,N/A,N/A,N/A,N/A,True,
The Last Survival (Movie),2021,N/A,25 Jun 2021,31 min,"Short, Adventure",Daniel Munoz,Joel Munoz Alonso,N/A,It about the movie that is about how his friends survive,English,United States,N/A,N/A,[],N/A,N/A,N/A,tt16751328,movie,N/A,N/A,N/A,N/A,True,
Movie Night,2021,N/A,N/A,N/A,"Short, Horror","Jude Hartley, Sylvie Markel, Kimberly McVicar",Kimberly McVicar,"Channing Brooker, Gabriel Rey Drake, Charleigh Grossman","When a group of kids plan a scary movie night, they never expected to become a part of it. Will they get out? Only time will tell.",English,United States,N/A,https://m.media-amazon.com/images/M/MV5BZGQ5NGQzODMtNDBjZS00YTY5LWJmMmYtOTkwNDdkNjQzMjBmXkEyXkFqcGdeQXVyMzQ0MDMzNTQ@._V1_SX300.jpg,[],N/A,N/A,N/A,tt15398900,movie,N/A,N/A,N/A,N/A,True,
You're Fucking Welcome the Movie,2021,N/A,N/A,N/A,"Short, Drama",Barbara Wilder,Barbara Wilder,"Barbara Wilder, Billy Grandy, Mark Sky",N/A,English,United States,N/A,https://m.media-amazon.com/images/M/MV5BODlhYjJlMmMtYTdiYi00OTczLWFjNGEtM2NjZWRhMDk3YzgyXkEyXkFqcGdeQXVyMTk0MTEzMzk@._V1_SX300.jpg,[],N/A,N/A,N/A,tt15421512,movie,N/A,N/A,N/A,N/A,True,
Movie Survival Guide,2021–,N/A,18 Aug 2021,N/A,Comedy,N/A,N/A,N/A,"Every movie genre has its own rules, and you need to know those rules if you're going to survive that genre. We look at the Top Ten rules of each genre in order to help you survive in that movie.",English,United States,N/A,https://m.media-amazon.com/images/M/MV5BYjI2ZjhlODctZDEwNC00MDRiLWI5YTItOWM1OWY0ZTllZjFjXkEyXkFqcGdeQXVyNTkwNDk3NA@@._V1_SX300.jpg,[],N/A,N/A,N/A,tt15325590,series,,,,,True,N/A
A Movie is Born,2021,N/A,29 Aug 2021,N/A,Short,Peter Boiadzhieff,Peter Boiadzhieff,"Stephen Blackmon, Peter Boiadzhieff","A closer look at the film community Fork Shop of how a movie is created by doing it. The Fork Shop is a community of independent film makers who strive to create amazing films by working together, helping each another.",English,United States,1 win,https://m.media-amazon.com/images/M/MV5BNWUyZTdjNjQtYTg2Ny00M2IxLWJkYTQtNjkwYjU5YTI1NzAzXkEyXkFqcGdeQXVyMTA0NjEwMzkw._V1_SX300.jpg,[],N/A,N/A,N/A,tt15329590,movie,N/A,N/A,N/A,N/A,True,
We're Trying to Make a G*ddamn Movie Here!,2021,N/A,28 Aug 2021,5 min,"Short, Comedy",Sarah E. Taylor,Sarah E. Taylor,"Mia Isabella Aguirre, Madeline Cavallaro, Claire Main",A green screen operator continues to accidentally derail an independent film studio's extra low budget romantic comedy.,English,United States,N/A,N/A,[],N/A,N/A,N/A,tt15332288,movie,N/A,N/A,N/A,N/A,True,
The Greydis and Aunjolie Movie,2021,N/A,19 Sep 2021,N/A,Romance,Geremy Barahona,Geremy Barahona,"Aunjolie Reyes, Greydis Torres",Aunjolie and Greydis do questionable stuff in the movie.,English,United States,N/A,N/A,[],N/A,N/A,N/A,tt15461298,movie,N/A,N/A,N/A,N/A,True,
The Keyon Movie,2021,Approved,01 Jan 2021,N/A,Action,Keyon Harrell,Keyon Harrell,Keyon Harrell,N/A,English,United States,N/A,N/A,[],N/A,N/A,N/A,tt15471982,movie,N/A,N/A,N/A,N/A,True,
Journey - The Movie,2021,G,16 Sep 2021,60 min,Sci-Fi,Minar Kishore Joshi,Minar Kishore Joshi,Minar Kishore Joshi,Synopsis - Journey is a Science Fiction-Musical movie which Explores all the In Earth and Out Earth places that exists within the earth and also within the universe.,English,India,N/A,N/A,[],N/A,N/A,N/A,tt15440520,movie,N/A,N/A,N/A,N/A,True,
Wonder Woman: Fan Film Series - DC Comics/Superheroine/Short movie/Fan Film,2021–,N/A,17 Sep 2021,N/A,Action,N/A,N/A,"Ramiz Aliev, Irina Bezryadina, Mikhail Bychkow",N/A,Russian,Russia,N/A,N/A,[],N/A,N/A,N/A,tt15445672,series,,,,,True,N/A
Mommy Lounge Show Podcast Movie,2021,Unrated,30 Sep 2021,N/A,Comedy,Katoria Chanyasubkit,"Renika Brannum, Katoria Chanyasubkit, Ashima Franklin","Renika Brannum, Monica Mz. Drummer Carter, Katoria Chanyasubkit",N/A,English,United States,N/A,https://m.media-amazon.com/images/M/MV5BNzA0Njk4OTAtNGEwZC00ZTA4LTkzNjgtZjEzNWUwNzMyOGFlXkEyXkFqcGdeQXVyOTM0MDQyNzI@._V1_SX300.jpg,[],N/A,N/A,N/A,tt15517224,movie,N/A,N/A,N/A,N/A,True,
The Novel Movie,2021,N/A,30 Sep 2021,75 min,"Mystery, Thriller",Les Sholes,Les Sholes,"Ben Heit, George Herda, Laura Nelson","When Kristi's mother commits suicide, Kristi and her husband Bryan head back to her childhood home out in the country to take care of her mother's affairs; selling the house and holding an auction. Soon Kristi starts to experience...",English,United States,N/A,https://m.media-amazon.com/images/M/MV5BMmUyZjhkNjYtOGZhOS00MTAwLTk3MmItNTJkOTZkYTk2MjhmXkEyXkFqcGdeQXVyNjUxNzcwOTM@._V1_SX300.jpg,[],N/A,N/A,N/A,tt15527956,movie,N/A,N/A,N/A,N/A,True,
By Any Means the Movie,2021,N/A,29 Sep 2021,82 min,Drama,N/A,N/A,"Chris Allen, Wise Bexley, Janae Black",2 friends go through the ropes to start their own record label after being scammed by an old record exec .,English,United States,N/A,N/A,[],N/A,N/A,N/A,tt15532608,movie,N/A,N/A,N/A,N/A,True,
Dora Gets Grounded the Movie 2,2021,N/A,04 Sep 2021,N/A,Action,Zak The GoAnimator,ZakTheGoAnimator,"Brian, David, Emma",N/A,English,United States,N/A,N/A,[],N/A,N/A,N/A,tt15545816,movie,N/A,N/A,N/A,N/A,True,
Trust the mini movie,2021,N/A,01 Oct 2021,N/A,"Short, Action",Joseph Chauncey Reaves,Joseph Chauncey Reaves,"Fats 62, Joseph Chauncey Reaves, Shawn","Joseph Chauncey Reaves known as J Spaz, plays A talented upcoming rapper with financial problems in cahoots with group of four friends running a PUA scam on the streets of their local neighborhood began to run into a few trust issues",English,United States,N/A,https://m.media-amazon.com/images/M/MV5BMzMzMjAzNmItMTUzYS00Y2I2LTgyYzYtN2Y3ODhlNTY0YTYwXkEyXkFqcGdeQXVyMTEyNjg2NjE2._V1_SX300.jpg,[],N/A,N/A,N/A,tt15550598,movie,N/A,N/A,N/A,N/A,True,
The Truck Driver Movie,2021,N/A,26 Nov 2021,N/A,"Action, Crime, War","Gary Davis, Ron Shimshilashvili","Gary Davis, Ron Shimshilashvili","Nicolas Guidazio, Courtney Miller, Slik Nasty",N/A,English,United States,N/A,https://m.media-amazon.com/images/M/MV5BOGU0NThjOGItM2MzZS00MTk0LWE0YTItNGFlZjk3ODNlMDU5XkEyXkFqcGdeQXVyMjI5Mzc1OTQ@._V1_SX300.jpg,[],N/A,N/A,N/A,tt15554334,movie,N/A,N/A,N/A,N/A,True,
Butt Detective The Movie: The Case Of The Courageous Curry + Mystery Of The Ladybug Ruins,2021,N/A,15 Jul 2021,N/A,N/A,N/A,N/A,N/A,N/A,N/A,N/A,N/A,https://m.media-amazon.com/images/M/MV5BYWYxNjkwOWItMTkxMS00MTRhLTkwMjUtZDZiMmYzYjg5MWZiXkEyXkFqcGdeQXVyMjQxNzY5NTc@._V1_SX300.jpg,[],N/A,N/A,N/A,tt15101058,movie,N/A,N/A,N/A,N/A,True,
37: The Movie,2021,Not Rated,30 Jul 2021,87 min,"Animation, Comedy",Joe Hoenisch,Joe Hoenisch,"Nick Dwyer, Joe Hoenisch, Isaac Molethu",N/A,English,United States,N/A,N/A,[],N/A,N/A,N/A,tt15222328,movie,N/A,N/A,N/A,N/A,True,
One Woman Movie,2021,N/A,14 Mar 2021,6 min,"Short, Comedy","Lindsey Hope Pearlman, Sean Welski",Lindsey Hope Pearlman,Lindsey Hope Pearlman,N/A,English,United States,N/A,https://m.media-amazon.com/images/M/MV5BMTQ3ZThmMTctN2U2ZC00NGYwLTk2NDAtY2IzNDdkZGU0MjIzXkEyXkFqcGdeQXVyMjUyMzQ3NTY@._V1_SX300.jpg,[],N/A,N/A,N/A,tt15238142,movie,N/A,N/A,N/A,N/A,True,
Silent Movie Renaissance,2021,N/A,20 Aug 2021,N/A,"Adventure, Comedy, Reality-TV",Jason DeStefano,Jason DeStefano,"Analyn DeStefano, Jason DeStefano",N/A,English,United States,N/A,https://m.media-amazon.com/images/M/MV5BYjlkNmRkZDctMWVmNC00YTkxLTk5OGUtMmI0ZTdhZTcxN2RkXkEyXkFqcGdeQXVyOTI4NzcxNjY@._V1_SX300.jpg,[],N/A,N/A,N/A,tt15242656,movie,N/A,N/A,N/A,N/A,True,
Lofi Cherokee: The Movie,2021,N/A,N/A,115 min,Documentary,Patrick Branson,Patrick Branson,N/A,"A documentary about a unique music video event held on a historic street in Saint Louis, MO showcasing the eclectic musical talent of the area.",English,United States,N/A,https://m.media-amazon.com/images/M/MV5BY2I3ZTNmZDYtNzA0ZC00ZDExLTlmMGItNTA0NWM5ZTU4NzkxXkEyXkFqcGdeQXVyMjI0NjYyMTU@._V1_SX300.jpg,[],N/A,N/A,N/A,tt15289146,movie,N/A,N/A,N/A,N/A,True,
Draeden Dorr: The Movie,2021,N/A,06 Jan 2021,53 min,Romance,Raphael Tuval,Raphael Tuval,"Saboor Sahak, Marina Salehzada, Raphael Tuval",N/A,N/A,France,N/A,https://m.media-amazon.com/images/M/MV5BZDhlOTg2ZDQtYmI0ZS00NDA3LWE3YzQtZjliMTY4NzlkYzEzXkEyXkFqcGdeQXVyMTIyNTYzMTI0._V1_SX300.jpg,[],N/A,N/A,N/A,tt15123878,movie,N/A,N/A,N/A,N/A,True,
The Jack Ruhl Show: The Movie,2021,N/A,25 Aug 2021,90 min,Documentary,Jack Ruhl,N/A,"Jack Ruhl, Justin Bul-Lalayao, Joe Jordan",A documentary about a college senior and his best friends throughout their last three years in film school.,English,United States,N/A,https://m.media-amazon.com/images/M/MV5BZDIwNDlkNWItN2EyOS00YWM2LTlmY2YtNTQyOTM1OTg0YTAzXkEyXkFqcGdeQXVyOTUzMjY4NjQ@._V1_SX300.jpg,[],N/A,N/A,N/A,tt15126948,movie,N/A,N/A,N/A,N/A,True,
Bentley the Movie,2021,N/A,23 Jul 2021,N/A,Drama,Dre Josiah,Dre Josiah,N/A,N/A,English,United States,N/A,N/A,[],N/A,N/A,N/A,tt15132578,movie,N/A,N/A,N/A,N/A,True,
TCFF Movie Trivia Night!,2021,N/A,12 Aug 2021,N/A,Comedy,Jake Beaver,"Jake Beaver, Chelsea Anne Lawrence, Joel Thingvall",N/A,Minnesota actors and experts meet for funny movie trivia.,English,United States,N/A,N/A,[],N/A,N/A,N/A,tt15132816,movie,N/A,N/A,N/A,N/A,True,
The MD/VA Movie Club,2021–,Not Rated,01 Aug 2021,N/A,Talk-Show,N/A,N/A,"Matthew Winstead, Dan Lane, Cayla Lane","Weekly geek news pop culture updates, film and tv gossip all discussed by the MD/VA Movie Club. The crew meet each week to discuss a different film that they have picked from the week before.",English,United States,N/A,https://m.media-amazon.com/images/M/MV5BY2ZmMzI0MjctNDA5NC00ZDE2LWJlNzItNmZjNTIzNzhlMzhkXkEyXkFqcGdeQXVyMTAzMjQzNDU4._V1_SX300.jpg,[],N/A,N/A,N/A,tt15136932,series,,,,,True,4
The APSI Farewell Movie - 2020,2021,N/A,03 Feb 2021,21 min,"Documentary, Short",Harshit Mishra,"Rishabh Dhelariya, Bhoomika Ladhani, Krish Sabha","Naman Agrawal, Vidit Agrawal, Nishita Ambwani","This movie/documentary represents emotional and happy moments with school seniors on the day of farewell. Representing Past and Present of School life, done in the most cinematic way possible.",Hindi,India,N/A,https://m.media-amazon.com/images/M/MV5BMzkwZDEwZjQtM2E2MC00MjdiLWI4ODUtYzhhNmI2MDVhNTljXkEyXkFqcGdeQXVyMTM1MDA2NTM2._V1_SX300.jpg,[],N/A,N/A,N/A,tt15140336,movie,N/A,N/A,N/A,N/A,True,
The GiovanniLoud Movie,2021,N/A,28 Sep 2021,N/A,Comedy,Giovanni Loud,Giovanni Loud,N/A,N/A,English,United States,N/A,N/A,[],N/A,N/A,N/A,tt15168294,movie,N/A,N/A,N/A,N/A,True,
Jack Neel - Strange Horror Movie Facts,2021–,N/A,20 Jun 2021,N/A,N/A,N/A,N/A,Jack Neel,N/A,English,United States,N/A,https://m.media-amazon.com/images/M/MV5BOGIwYWIxYmYtYWU3YS00NTFhLWJhNTMtODU3OGNmOWM2YjYwXkEyXkFqcGdeQXVyMTE4NzExMzMx._V1_SX300.jpg,[],N/A,N/A,N/A,tt15169174,series,,,,,True,1
The Mighty Six Movie,2021,N/A,17 Dec 2021,72 min,"Animation, Musical, Adventure",Cole Banduam,Kieron Faming,"Samir Adams, Anaya Hawley- Ayodeji, George Berger","Mandy gets an phone call about the biggest concert ever in Plotagon City, and really wants to bring the Mighty Six back together. Will they be successful and win the trophy.","Spanish, German, Dutch, French, English","United States, France, United Kingdom",N/A,https://m.media-amazon.com/images/M/MV5BODJiZDNiYTItMjAzMC00MTNhLTllNWYtYWY1N2YyMWVkMmUwXkEyXkFqcGdeQXVyMTI4ODI2MzIy._V1_SX300.jpg,[],N/A,N/A,N/A,tt15170304,movie,N/A,N/A,N/A,N/A,True,
The Least Ghastly Bloody War Movie Ever Made,2021,N/A,17 Oct 2021,18 min,"Short, Family",Rafael Petlock,Lee Irving,"Olivia Colon, Ian Drake, Tyler Drake",N/A,English,N/A,N/A,https://m.media-amazon.com/images/M/MV5BNWZlZTE1YWYtZTE5OS00YzU4LWI0ZTgtNWFkY2QwNjliNGUxXkEyXkFqcGdeQXVyMTAxNTUxMzEz._V1_SX300.jpg,[],N/A,N/A,N/A,tt16914754,movie,N/A,N/A,N/A,N/A,True,
Street Light: The Movie,2021,N/A,12 Apr 2021,70 min,"Documentary, Drama, Music",KRS-One,N/A,KRS-One,N/A,English,United States,N/A,https://m.media-amazon.com/images/M/MV5BYTE0NmMyMmYtYThlYi00NjExLWFkNzctNzg1M2Q1YWM4ZmI4XkEyXkFqcGdeQXVyMTAwMjgyOTY4._V1_SX300.jpg,[],N/A,N/A,N/A,tt17024132,movie,N/A,N/A,N/A,N/A,True,
The Perfect Movie,2021,N/A,08 Feb 2021,79 min,Comedy,Efrain Flores,Efrain Flores,"Efrain Flores, Rene Flores, Juan Felipe Restrepo",Two filmmakers are ending their senior year in film school and now have to come up with a short film idea to pass their final and impress their professor Mr.D.,English,United States,N/A,https://m.media-amazon.com/images/M/MV5BMzY0ZjQzNmItNGVjMy00NDU4LWFkZmItMTNiMWYxZjY5YzgwXkEyXkFqcGdeQXVyNzk5NDMyMzQ@._V1_SX300.jpg,[],N/A,N/A,N/A,tt17493278,movie,N/A,N/A,N/A,N/A,True,
Another Holiday: The Movie,2021,N/A,26 Dec 2021,113 min,Drama,Teejay RossOscar,"Andona Ingya, Ifeanyi Nwankwere","Monisola Adetiba, Itie Bade Akerejola, Ifeanyi Nwankwere",N/A,English,Nigeria,N/A,N/A,[],N/A,N/A,N/A,tt18227496,movie,N/A,N/A,N/A,N/A,True,
Finger Guns: The Movie,2021,N/A,03 Feb 2021,N/A,"Short, Comedy",Christopher Tempel,N/A,"Beth Fritz, Sam Fritz, Karissa Tempel",N/A,English,United States,N/A,N/A,[],N/A,N/A,N/A,tt18351840,movie,N/A,N/A,N/A,N/A,True,
SNF Week 6 Preview: Seahawks vs Steelers (2021) Primetime Football & a Movie (Grudge Match),2021,N/A,16 Oct 2021,N/A,N/A,N/A,N/A,N/A,N/A,N/A,N/A,N/A,N/A,[],N/A,N/A,N/A,tt18523546,movie,N/A,N/A,N/A,N/A,True,
MSPT: The Movie,2021,N/A,11 Jun 2021,89 min,Action,"Marcus Smith, Tashagamer","Marcus Smith, Marcus Smith","Pig Master, Yariel, Quan Redtail","After the events of ""Toad's Mistake 3"", Toad invades the MSPT universe, looking for Mario and his friends to kill and conquer. Mario, Sonic, Luigi, and Tails has a mission to defeat Toad - but this time, things get more interesting.",N/A,United States,N/A,https://m.media-amazon.com/images/M/MV5BMGY4YTM4MmQtZWQ4Yy00ODM5LTg1MjgtNzAwNzgzZWFiOTM4XkEyXkFqcGdeQXVyMTUwNTkwNTI1._V1_SX300.jpg,[],N/A,N/A,N/A,tt19120166,movie,N/A,N/A,N/A,N/A,True,
The shabankables movie,2021,Approved,27 Oct 2021,N/A,"Animation, Short",Shakur Bancus Ali,N/A,Plotagon Story,A young guy named Bancus aka shabankables teams up with a movie director named Brad the director to make a movie for a guy named Bret who is trying to destroy the world,English,N/A,N/A,https://m.media-amazon.com/images/M/MV5BNTdjMTYwN2UtNTMwZS00MmRlLWJjZTktNmQzMWI2YjhjNjM1XkEyXkFqcGdeQXVyMTQ2NjAzNTgz._V1_SX300.jpg,[],N/A,N/A,N/A,tt19364880,movie,N/A,N/A,N/A,N/A,True,
"Et Tu, Rob?: The Play: The Movie",2021,N/A,14 Dec 2021,103 min,"Comedy, Crime",Erik Wells,Peter Bashaw,"Joshua Mutterperl, Christian Wachter, Ally Watkinson","Moments before the curtains rise on their high school's production of Julius Caesar, Rob (the actor playing Brutus) accidentally stabs Wyatt (Caesar) backstage. Rob and his best friend Craig (Cassius) must then try to get Wyatt re...",English,United States,N/A,https://m.media-amazon.com/images/M/MV5BYjY4ZGE1NDItOTgxMS00MmQxLTk1OWEtODY1MTA5ZDkzMjFlXkEyXkFqcGdeQXVyNDk3NzY5NzE@._V1_SX300.jpg,[],N/A,N/A,N/A,tt19389178,movie,N/A,N/A,N/A,N/A,True,
Horrible Movie. A Brief History of Russian Amateur Trash Horror Cinema,2021,N/A,27 Feb 2022,102 min,Documentary,Maxim Poltavchenko,Maxim Poltavchenko,"Pavel Fominenko, Viktor Murzikov, Maxim Poltavchenko","The film tells the story of several representatives of the Russian amateur thrash and horror cinema. The characters remember how they took their first steps on the set, what difficulties they faced, how their fate turned out in th...","English, Spanish, Russian",Russia,N/A,https://m.media-amazon.com/images/M/MV5BNWJhZmZhZDMtOGU5MS00MzVkLWEwN2ItOGU1YWViMmM2Y2IzXkEyXkFqcGdeQXVyMTUyMjI0Njkx._V1_SX300.jpg,[],N/A,N/A,N/A,tt19784362,movie,N/A,N/A,N/A,N/A,True,
The SASS Movie,2021,N/A,20 Dec 2021,N/A,Comedy,Vishal Muralee,"Vishal Muralee, Riley Thornton-Mackay","Gibby, Ali Haider, Issac",N/A,English,Australia,N/A,https://m.media-amazon.com/images/M/MV5BMGU0OTU3ZWQtNDg0OS00ZDliLWJhNjMtNjNiYTBlMjJmM2YwXkEyXkFqcGdeQXVyMTUyNDQwMDgz._V1_SX300.jpg,[],N/A,N/A,N/A,tt19864182,movie,N/A,N/A,N/A,N/A,True,
Swag City Movie,2021,N/A,14 Nov 2021,4 min,"Animation, Short",Sebaroni,N/A,"Sebo Bruh, Callovv, Isa Gaming","The Mfs of Swag City become a strong goofy ahh team and fight ""Bro:skull:"" and become a team with him. They all end up fighting ""S3gaming"" and lonely ahh ""Anna Banana"".",English,United States,N/A,N/A,[],N/A,N/A,N/A,tt19882152,movie,N/A,N/A,N/A,N/A,True,
The Yellow Queen a road movie,2021,N/A,27 Oct 2021,87 min,Documentary,Lucio Arisci,N/A,Lucio Arisci,"One way journey from Germany to Mali on the routes of an unexpected ""underground"" and semi-clandestine trade. A road trip to widen our horizons as ""Western citizens"" towards a broader and more sustainable vision of consumer society.",English,N/A,N/A,https://m.media-amazon.com/images/M/MV5BYjExYTliMjgtMjI2Yi00ZDE1LThjNWUtNzU4MWFiM2NiZjdmXkEyXkFqcGdeQXVyMTI5NzA1ODI5._V1_SX300.jpg,[],N/A,N/A,N/A,tt19889128,movie,N/A,N/A,N/A,N/A,True,
90 Day Rule the movie,2021,N/A,07 Mar 2021,110 min,Romance,Karim Jamal,"Tony Robinson Jr., Michelle Yvonne","Shon Berry, Rae'l Regina Charles, Dedric Dec Colbert","Tamia has it all nice house, nice car and a loving relationship, until one day she catches her boyfriend cheating.. That's when she comes up with the 90 Day Rule..",English,United States,N/A,https://m.media-amazon.com/images/M/MV5BNjhjYzBlOTctOTdjMS00NmFhLWFmZDctOWRkMTA0YTI2YjM3XkEyXkFqcGdeQXVyOTkwMTY5ODM@._V1_SX300.jpg,[],N/A,N/A,N/A,tt20197040,movie,N/A,N/A,N/A,N/A,True,
Episode 48: Movie Review - The Cursed (2021) Don't F**k with Gypsies,2021,N/A,03 Apr 2022,N/A,Horror,N/A,Benjamin Dutill,N/A,N/A,N/A,United States,N/A,https://m.media-amazon.com/images/M/MV5BZjcwYTc3NzUtYTk0Yi00MDAwLTk0MjAtMjI1MjA4MGZlODA3XkEyXkFqcGc@._V1_SX300.jpg,[],N/A,N/A,N/A,tt20252726,movie,N/A,N/A,N/A,N/A,True,
B-Movie Enema,2021–,N/A,02 Jan 2021,N/A,Comedy,N/A,N/A,"Geoff Arbuckle, Carolyn Bruce, Jason Oliver","Geoff Arbuckle, B-Movie Proctologist, watches movies with his trusty companion and partner Nurse Disembaudee.",English,United States,N/A,N/A,[],N/A,N/A,N/A,tt20518454,series,,,,,True,3
Ultraman Sorta vs. Godzilla Starring Matt Frank: The Movie,2021,N/A,10 Jul 2021,6 min,"Short, Comedy, Sci-Fi",Jared Foust,N/A,"Mike Dent, Billy Dubose, Jared Foust","Despite repeatedly being told not to, famed kaiju illustrator Matt Frank presses a button he shouldn't have pressed.",English,United States,N/A,https://m.media-amazon.com/images/M/MV5BYzk3ZTRjN2ItNzljMy00YmY5LWExYTgtODQwNmE5YTU2YTg5XkEyXkFqcGdeQXVyMTIyNjQ1OTMy._V1_SX300.jpg,[],N/A,N/A,N/A,tt21198416,movie,N/A,N/A,N/A,N/A,True,
Ging Movie: Hunt the Hunter,2021,N/A,05 Oct 2021,N/A,Short,A. Yigit Akkus,A. Yigit Akkus,"Ekin Bernay, Dogukan Kanik, Deniz Tekin",N/A,English,Turkey,N/A,https://m.media-amazon.com/images/M/MV5BMDc3MTFmMTItMDlkOC00NDUxLWI5ZmYtMWVkMzNmYzU3NTA0XkEyXkFqcGc@._V1_SX300.jpg,[],N/A,N/A,N/A,tt21406148,movie,N/A,N/A,N/A,N/A,True,
Bombaster Letspley: The Movie,2021,N/A,30 Dec 2021,60 min,Documentary,Petr Utochkin,Kirill Denisenko,"Kirill Denisenko, Egor Vyatkin",A documentary about the life of video game reviewer Kirill Denisenko in a small Russian village.,Russian,Russia,N/A,N/A,[],N/A,N/A,N/A,tt21905664,movie,N/A,N/A,N/A,N/A,True,
Movie Jo Night,2021–,N/A,21 Sep 2021,N/A,Comedy,N/A,N/A,"Mary Jo Pehl, Chris Gersbeck, Seymour",N/A,English,United States,N/A,https://m.media-amazon.com/images/M/MV5BOTFkMTNlZTYtZjg1Yi00NzBmLThmOWMtZjY2YzRjYzI2NzhjXkEyXkFqcGdeQXVyNzExMzc0MDg@._V1_SX300.jpg,[],N/A,N/A,N/A,tt22075060,series,,,,,True,1
Super Tom: The Movie,2021,N/A,15 Jun 2021,125 min,Talk-Show,"Richard Norris, Steven Riches",N/A,"Arnold Kelly, Lizzie Richardson, Matthew Richardson",N/A,English,United Kingdom,N/A,N/A,[],N/A,N/A,N/A,tt22326064,movie,N/A,N/A,N/A,N/A,True,
The Joexian Mercado Movie: World's Largest Mcdonalds,2021,N/A,25 Dec 2021,177 min,"Adventure, Comedy",Joexian Mercado,Joexian Mercado,"Joel Mercado, Joexian Mercado, Monica Mercado","Joexian And His Family Arrive At Florida To Find The World's Largest Mcdonalds. First, They Go To Disney World.",English,United States,N/A,N/A,[],N/A,N/A,N/A,tt22382032,movie,N/A,N/A,N/A,N/A,True,
Joexian and Nate: The Movie,2021,N/A,20 Sep 2021,103 min,"Animation, Adventure, Horror",Joexian Mercado,Joexian Mercado,"Joexian Mercado, Nate","After Delivering A Neon Pizza At Building Brothers' Pizza, Joexian And Nate Go To Bed Only To Wake Up And End Up In A Scary Place That Is Haunted By An Evil Stuffed Bear.",N/A,United States,N/A,N/A,[],N/A,N/A,N/A,tt22457282,movie,N/A,N/A,N/A,N/A,True,
I'M sorry horror movie 2021,2021,N/A,06 Oct 2021,N/A,"Short, Horror",Shahzada,Shahzada,"Tamanna Mahajan, Shahzada",N/A,Hindi,India,N/A,https://m.media-amazon.com/images/M/MV5BYjk0ZWU3MDItNDBlZC00NDRkLThlNzctYmU3YjRhNmU2ZTAyXkEyXkFqcGdeQXVyMTU2OTY4MDkx._V1_SX300.jpg,[],N/A,N/A,N/A,tt22489062,movie,N/A,N/A,N/A,N/A,True,
