Title,Year,Rated,Released,Runtime,Genre,Director,Writer,Actors,Plot,Language,Country,Awards,Poster,Ratings,Metascore,imdbRating,imdbVotes,imdbID,Type,DVD,BoxOffice,Production,Website,Response,totalSeasons
Let's Make a Movie,2021,N/A,07 Feb 2021,30 min,"Short, Comedy","Dave Farese, Stephen Vanderpool","Dave Farese, Stephen Vanderpool","J. Cyrus, Dan Nufer, Tyler Adams","Dave and Steve would do anything to get action star Chad Worthington to be in their film, even if it means kidnapping him. But when the boys accidentally kill their hero they're forced to find a way to finish what they started.",English,United States,N/A,https://m.media-amazon.com/images/M/MV5BZGRjYzczMDEtYjRjYS00NGIzLTllZTItZGFiMjFlNjM1MjQ0XkEyXkFqcGdeQXVyNjgxMTg3NjQ@._V1_SX300.jpg,[],N/A,N/A,N/A,tt13971146,movie,N/A,N/A,N/A,N/A,True,
Family Movie Night: Little Red Bronana Bread,2021,N/A,23 Feb 2021,N/A,"Animation, Short",N/A,N/A,N/A,"Join the Croods as they settle down for a very prehistoric family movie night experience. With shadowy figures around every corner, Eep must keep Gran and her delicious Bronana Bread safe from punch monkeys.",English,USA,N/A,N/A,[],N/A,N/A,N/A,tt13972128,movie,N/A,N/A,N/A,N/A,True,
MooN: The Movie,2021,N/A,28 Jan 2021,11 min,Short,Augustin De Lapeyrière,Augustin De Lapeyrière,Augustin De Lapeyrière,"When a young artist gets caught by sleep in the middle of the night, he embarks on a journey between dream and nightmare towards the moon.","French, English",France,N/A,https://m.media-amazon.com/images/M/MV5BMjU0YzliY2EtNjM3Ny00YWYwLWI3MGEtYzBjMDNjNjQ1ODM2XkEyXkFqcGdeQXVyMTI5MTYyMzQ5._V1_SX300.jpg,[],N/A,N/A,N/A,tt13988730,movie,N/A,N/A,N/A,N/A,True,
Retribution the Movie,2021,N/A,20 Mar 2021,18 min,"Short, Drama","Julio Montalvo, Paulette D. Harris",Julio Montalvo,"Oshun Aqueira, Terrance Brown, Anthony Clark","Retribution is the story of a man looking to get revenge for his brother's murder, but during the search for his brother's killer, he finds redemption.",English,United States,1 win,https://m.media-amazon.com/images/M/MV5BMTVmZWY2NWMtY2Q3Yi00ZmVkLWIzYjEtYTAyMWRmYmY4NjRkXkEyXkFqcGdeQXVyMzYxNDMwNTU@._V1_SX300.jpg,[],N/A,N/A,N/A,tt13989486,movie,N/A,N/A,N/A,N/A,True,
A movie about Amnesia (Temporary Name),2021,N/A,N/A,N/A,"Short, Crime",N/A,N/A,N/A,N/A,N/A,N/A,N/A,N/A,[],N/A,N/A,N/A,tt14004612,movie,N/A,N/A,N/A,N/A,True,
Radio - the movie,2021,N/A,06 Feb 2021,N/A,"Short, Drama",Ameeya Mehta,Ameeya Mehta,"Gaurav Mehta, Akshada Sawant, Anchal Sharma",N/A,Hindi,United States,N/A,N/A,[],N/A,N/A,N/A,tt14009254,movie,N/A,N/A,N/A,N/A,True,
This Movie Must Die!,2021–,N/A,07 Jan 2021,N/A,"Documentary, Talk-Show",N/A,N/A,"Stephen Spurling, Erin Peris, Josh Spurling","Two movies battle for the love of three reviewers, but only one cinematic effort will survive. Which movie will they pardon and which will they condemn? Find out in every nerve-wracking episode.",English,United States,N/A,https://m.media-amazon.com/images/M/MV5BYzY2ZDY5NWItM2FlMS00NGZlLTkwOWYtNzUzY2QwZjk1ZWQyXkEyXkFqcGdeQXVyMDY3OTcyOQ@@._V1_SX300.jpg,[],N/A,N/A,N/A,tt14009272,series,,,,,True,1
Blame Movie,2021,N/A,02 Apr 2021,N/A,Drama,Jarrell Crump,Alyze Elyse,"Jarhyiene Alassane, Ladon Brown, June Buckner, Keyson Davis","In a time when family matters the most, internal struggles brings about confusion. In this journey, four strong individuals are divided by either to protect each other or keep the love they have for the streets.",English,USA,N/A,https://m.media-amazon.com/images/M/MV5BY2ZmZmZiMjAtNDllZC00ZjMxLWEzZWQtZDRlZTFkYTU5MjdiXkEyXkFqcGdeQXVyMzQyNzI1NTQ@._V1_SX300.jpg,[],N/A,N/A,N/A,tt14029870,movie,N/A,N/A,N/A,N/A,True,
"Two Superheroes, a Villain, and a Baby - The Movie",2021,N/A,10 Feb 2021,27 min,"Animation, Short",Randy W. Schmidt,Randy W. Schmidt,"Randy W. Schmidt, Dylan Schmidt, Thelma Rún Heimisdóttir","Stuck in coronavirus lockdown, reluctant roommates Batman, Superman, and Joker are suddenly tasked with raising Wonder Woman's baby.",English,Japan,N/A,https://m.media-amazon.com/images/M/MV5BZTI0OTc3MDktMWZkZS00OWYxLWJjZDMtMWNmNjgwOWM5NDE5XkEyXkFqcGdeQXVyNzIzNjA5Nzk@._V1_SX300.jpg,[],N/A,N/A,N/A,tt14056498,movie,N/A,N/A,N/A,N/A,True,
Can YOU Guess the Movie Location in Real Life!?,2021,N/A,20 Jan 2021,N/A,N/A,N/A,N/A,N/A,N/A,English,United States,N/A,N/A,[],N/A,N/A,N/A,tt14088538,series,,,,,True,N/A
"Can YOU Guess the Movie Location in Real Life? (The Office, Clueless)",2021,N/A,20 Jan 2021,N/A,N/A,N/A,N/A,N/A,N/A,English,United States,N/A,N/A,[],N/A,N/A,N/A,tt14090144,series,,,,,True,N/A
Living in a Movie,2021,N/A,01 Mar 2021,N/A,"Short, Comedy",Gabriele Muccino,Emiliano Corapi,"Michelangelo De Vitis, Gabriele Muccino, Titti Nuzzolese",N/A,Italian,Italy,N/A,https://m.media-amazon.com/images/M/MV5BZTc2NGM2NzItNzQyNS00ZDYzLThhNTQtZDBkY2MyYjU1NWNjXkEyXkFqcGdeQXVyMzc4MzAwMzU@._V1_SX300.jpg,[],N/A,N/A,N/A,tt14302602,movie,N/A,N/A,N/A,N/A,True,
Glossier's Lash Slick: The Movie,2021,N/A,16 Mar 2021,N/A,Short,N/A,N/A,Catherine Shannon,N/A,English,United States,N/A,N/A,[],N/A,N/A,N/A,tt14316940,movie,N/A,N/A,N/A,N/A,True,
A Chat Movie,2021,N/A,06 Jun 2021,N/A,Comedy,Alejandro Santaella,"José Carlos Gamero, Alejandro Santaella","Novoa Alba, Laura Baena, Yiyi Benítez","Jorge is a recluse, living his daily life in front of his computer and doing little else with his life, but all that will change when a mysterious hacker shows up with sensitive information that could change everything. It will be up",English,Spain,N/A,https://m.media-amazon.com/images/M/MV5BZmVmYmZjNDgtYTU1YS00YzFmLWJmMjMtMjA5YThhNDU1YWVmXkEyXkFqcGdeQXVyOTEzMTM0ODE@._V1_SX300.jpg,[],N/A,N/A,N/A,tt14348770,movie,N/A,N/A,N/A,N/A,True,
I Feel Cold (Berdeneh the Movie),2021,N/A,01 May 2021,N/A,Crime,Nadim Mehanna,Claudia Marshalian,"Badih Bou Chakra, Joseph Bou Nassar, Roula Hamadeh","Dania discovers that Bassem the murderer husband of her twin sister has been released from jail; so she begins a relentless quest for bloody revenge, with one aim, her sister's last words ""I feel cold""!",Arabic,Lebanon,N/A,https://m.media-amazon.com/images/M/MV5BOTYwZTJmNjEtYTUyOC00NzE4LThlNDgtNzhhZWEyMTM1NDhhXkEyXkFqcGdeQXVyMTE0Mjg1NjA3._V1_SX300.jpg,[],N/A,N/A,N/A,tt14362740,movie,N/A,N/A,N/A,N/A,True,
The Keymaster Movie,2021,N/A,N/A,61 min,"Drama, Fantasy, Sci-Fi","Hunter Crossman, Rowan Wood","Hunter Crossman, Rowan Wood","Cayd Barrera, Hunter Crossman, Nate Wood, Rowan Wood",N/A,English,USA,N/A,N/A,[],N/A,N/A,N/A,tt14372230,movie,N/A,N/A,N/A,N/A,True,
6 Shots the Movie,2021,N/A,09 Jul 2021,N/A,"Short, Action",Monei Sutton,"Tobie Famusipe, Owerri Marrasha","Tobias Armand, Bj Bowman, Carl W. Childers","Kolofemi Olajide, a retired Marine was an assassin for many years fighting for the less priviledged, He decides to retire and settle down but the sins of his past comes back to haunt him, His brother Yemi running for Governor gets ki",English,United States,N/A,https://m.media-amazon.com/images/M/MV5BYjRlNGU1ZmItYmQyMS00OTk4LTg0NjAtNjhjNjA5NWIxZGMwXkEyXkFqcGdeQXVyNjEyNzE0OTk@._V1_SX300.jpg,[],N/A,N/A,N/A,tt14375604,movie,N/A,N/A,N/A,N/A,True,
The Jayden Marcelin Room Movie,2021,TV-Y7,10 Jul 2021,83 min,"Action, Comedy",Jayden Marcelin,N/A,N/A,A young beautiful couple finds theirs lives all the houses endangered by a movie in the jayden Marcelin room movie from hell professional boys mens and girls turns a crush intolerance obsession by trying everything possible to cap...,"English, French",United States,N/A,https://m.media-amazon.com/images/M/MV5BYjI3MjM0ZjctODc2Ny00NmQ3LTk5YTYtY2Y5NjQ4YzAzYWU2XkEyXkFqcGdeQXVyMTIzNjU2OTM2._V1_SX300.jpg,[],N/A,N/A,N/A,tt14408010,movie,N/A,N/A,N/A,N/A,True,
Hood Movie,2021,N/A,24 Jun 2021,N/A,"Action, Comedy",Villa Mane,Villa Mane,"Aamara, Reezy Alkyda, Joy Daily",A young man decides to drop everything and pursue his filmmaking dream. He realize it's tougher than he thought I'd be.,English,United States,N/A,https://m.media-amazon.com/images/M/MV5BZmVhOTkxMDItMTVmMS00MTBhLWEyZGUtY2M4NDhjYjdlY2ZiXkEyXkFqcGdeQXVyNDczNjUyNDU@._V1_SX300.jpg,[],N/A,N/A,N/A,tt14468840,movie,N/A,N/A,N/A,N/A,True,
The Audition the Stage Play the TV Movie,2021,N/A,24 Dec 2021,60 min,Drama,Wayne Drewoth,Kenneth K. Robbins,"Kenzie Mackenzie J.K. Espoir Paterson, Ife Eefay Zuri",N/A,English,Canada,N/A,N/A,[],N/A,N/A,N/A,tt14477502,movie,N/A,N/A,N/A,N/A,True,
Deception and Lies(the movie),2021,N/A,01 Jan 2021,85 min,Drama,Andretti Dante,"Shaun Fletcher, Brookie Nickleson (created by)","Christy Alvarado, William Bouton, Savannah Cazares, Shaun Fletcher","A group of friends decide to move back to Arizona after the untimely death of their best friend. Only coming home might create more problems than solutions as secrets, lies, deception and old feelings tear their friendships apart.",English,USA,N/A,https://m.media-amazon.com/images/M/MV5BNDlmMjAzMWItOGU4MS00ZDE0LWI0NTEtOTM4ZjI3MzY2ZWY3XkEyXkFqcGdeQXVyOTQ3NTM0Ng@@._V1_SX300.jpg,[],N/A,N/A,N/A,tt13756374,movie,N/A,N/A,N/A,N/A,True,
Mad Therapy Session the TV Movie,2021,N/A,30 Apr 2021,60 min,"Adventure, Comedy, Drama","Kenzie Mackenzie Espoir Paterson, Samantha Sammy C. Taylor","Kenzie Mackenzie Espoir Paterson, Samantha Sammy C. Taylor","Jennifer Anne Brown, Wayne Drewoth, Kenzie Mackenzie Espoir Paterson",N/A,English,Canada,N/A,N/A,[],N/A,N/A,N/A,tt13773762,movie,N/A,N/A,N/A,N/A,True,
The Marriage Affair the TV Movie,2021,N/A,28 Apr 2021,60 min,"Comedy, Drama, Mystery","Kenzie Mackenzie Espoir Paterson, Samantha Sammy C. Taylor","Kenzie Mackenzie Espoir Paterson, Samantha Sammy C. Taylor","Jennifer Anne Brown, Wayne Drewoth, Kenzie Mackenzie Espoir Paterson",N/A,English,Canada,N/A,N/A,[],N/A,N/A,N/A,tt13779508,movie,N/A,N/A,N/A,N/A,True,
Movie Bug's Blu-ray Collection 2021,2021,N/A,08 Jan 2021,96 min,Documentary,N/A,Svp,James Lack,N/A,English,UK,N/A,N/A,[],N/A,N/A,N/A,tt13806820,movie,N/A,N/A,N/A,N/A,True,
How We Made A Low Budget Movie,2021,N/A,15 Jan 2021,62 min,Documentary,Jason Park,Jason Park,"Katie Beyoglides, Christopher Deon, Luke Dingess, Ashanti Harris","We take a dive into how we made a low budget film, not look so low budget. We guide you on the process from start to finish. And share behind the scene footage, of how we made Rex Park: Curse of the Golden Buddha.",English,USA,N/A,https://m.media-amazon.com/images/M/MV5BMzkwNDBmMjEtNWY0Ni00OGMxLTk1MTYtMjgyNjYwYmUxZGUxXkEyXkFqcGdeQXVyMjAwMzc0NTY@._V1_SX300.jpg,[],N/A,N/A,N/A,tt13838478,movie,N/A,N/A,N/A,N/A,True,
Scary Paranormal Movie,2021,N/A,03 Jun 2021,N/A,"Short, Sci-Fi",George Abagis,Kadrolsha Ona Carole,"John O'Hurley, Billy West, Kadrolsha Ona Carole","Events in the movie reflect the real life events of Kadrolsha Ona Carole with the twist. Laugh, cry and be scared. This is just one of many to be produced.",English,United States,N/A,https://m.media-amazon.com/images/M/MV5BM2NiMTJiZGQtZjFmNy00YmJmLTk3OWUtN2IxOTczNjliZTVmXkEyXkFqcGdeQXVyNTgzNDgwOTI@._V1_SX300.jpg,[],N/A,N/A,N/A,tt13875996,movie,N/A,N/A,N/A,N/A,True,
The Movie Whisperer,2021–,N/A,08 May 2021,N/A,Documentary,N/A,N/A,"Houston Coley, Bryan Coley","After the wild rollercoaster of 2020, Houston Coley is finally convinced of his dad's wild theory that The Oscars have been foreshadowing the cultural narrative years in advance. Houston ...",English,USA,N/A,https://m.media-amazon.com/images/M/MV5BODcwNDlkYjQtYzA0Zi00MDUzLWIyNWQtZWY0ZDEzMDYzYzg2XkEyXkFqcGdeQXVyNjMzMzE2NTI@._V1_SX300.jpg,[],N/A,N/A,N/A,tt13887616,series,,,,,True,N/A
Radio - the movie,2021,N/A,06 Feb 2021,N/A,"Short, Drama",Ameeya Mehta,Ameeya Mehta,"Gaurav Mehta, Akshada Sawant, Anchal Sharma","Radio - A Story of Hope. Sometimes when life gets tough, a small glimmer of light at the end of the tunnel is all you need to swim through the rough water.",Hindi,United States,N/A,https://m.media-amazon.com/images/M/MV5BOTQ4YmJjYTgtZGYxMC00Y2YwLWE5ZTEtMTJhODYzZGRhNjczXkEyXkFqcGdeQXVyMTI4NjkwODQx._V1_SX300.jpg,[],N/A,N/A,N/A,tt13905650,movie,N/A,N/A,N/A,N/A,True,
Radio - the movie,2021,N/A,06 Feb 2021,N/A,"Short, Drama",Ameeya Mehta,Ameeya Mehta,"Gaurav Mehta, Akshada Sawant, Anchal Sharma","Radio - A Story of Hope. Sometimes when life gets tough, a small glimmer of light at the end of the tunnel is all you need to swim through the rough water.",Hindi,United States,N/A,N/A,[],N/A,N/A,N/A,tt13918878,movie,N/A,N/A,N/A,N/A,True,
YouTube Poop: The Movie,2021,N/A,06 Mar 2021,N/A,Comedy,Jashonn Reese,Jashonn Reese,N/A,The YouTube Poop people must save the YouTube Poop universe before Article 13 destroys it.,English,United States,N/A,N/A,[],N/A,N/A,N/A,tt13716174,movie,N/A,N/A,N/A,N/A,True,
John Chambers's Small's World the Stage Play TV Movie,2021,N/A,30 May 2021,60 min,"Adventure, Comedy, Fantasy",Kenzie Mackenzie Espoir Paterson,"John Chambers (Writer), John Chambers (original creator)","Lisa Marie Abelsen Hubert, Torin T.C. Crowe",N/A,English,Canada,N/A,N/A,[],N/A,N/A,N/A,tt13515506,movie,N/A,N/A,N/A,N/A,True,
Fin Burn's CourtHouse Banter the Stage Play TV Movie,2021,N/A,22 Apr 2021,60 min,"Adventure, Crime, Drama, Mystery, Thriller",Samantha Sammy C. Taylor,"Fin Burn (Writer), Fin Burn (original creator), Samantha Sammy C. Taylor (developed for television by)","Kenzie Mackenzie Espoir Paterson, Isaiah Kallstrom, Alyssa Ally Goulden",N/A,English,Canada,N/A,N/A,[],N/A,N/A,N/A,tt13598020,movie,N/A,N/A,N/A,N/A,True,
Thom Goddard's There Can Be Only One the Stage Play TV Movie,2021,N/A,28 Apr 2021,60 min,Comedy,Samantha Sammy C. Taylor,"Thom Goddard, Kenzie Mackenzie Espoir Paterson, Samantha Sammy C. Taylor","Jennifer Anne Brown, Wayne Drewoth",N/A,English,Canada,N/A,N/A,[],N/A,N/A,N/A,tt13598640,movie,N/A,N/A,N/A,N/A,True,
Light Sleeper: The Midlife Movie,2021,N/A,25 Jan 2021,18 min,"Documentary, Short, Biography, Crime, Talk-Show",N/A,N/A,Paul Schrader,N/A,English,UK,N/A,https://m.media-amazon.com/images/M/MV5BN2E3YmFmNmItZmVlOS00NDY0LTk3ZDMtYzQ4YWNkMzg0ZGRhXkEyXkFqcGdeQXVyMTY1MTcxMzc@._V1_SX300.jpg,[],N/A,N/A,N/A,tt13599914,movie,N/A,N/A,N/A,N/A,True,
Movie Palace 11,2021–,N/A,01 Jan 2021,N/A,Comedy,N/A,N/A,"Paige Mobley, Thomas Kellogg, Jensine Nickelberry",N/A,English,USA,N/A,N/A,[],N/A,N/A,N/A,tt13022024,series,,,,,True,N/A
The Eye's of A Woman and Man 2020 TV Movie,2021,N/A,03 Oct 2021,N/A,Romance,"Cassandra Askew, Errance Davis",Howard Hines,"Miranda Bryant, Dennis Groves, Howard Hines",The Eye's Of A woman And Man is about a young woman named Julie in search of her soulmate and all the while Jarvis is in search of the same thing. The plot takes a turn when Julie falls in love with Melvin but Melvin has a deep se...,English,United States,N/A,https://m.media-amazon.com/images/M/MV5BYzkxZjg4NjItZjYwYS00NGUzLWE0MWEtZGNhMjNkMjJlMjY3XkEyXkFqcGdeQXVyMTE0MzU2NzQ2._V1_SX300.jpg,[],N/A,N/A,N/A,tt13224514,movie,N/A,N/A,N/A,N/A,True,
"Serenity Farm, the Movie",2021,N/A,N/A,N/A,Thriller,James Becket,John Rodsett,"Michael Emery, John Rodsett","A secret naval mission to the Congo, the crew contracted the Ebola Virus. Cousin William escaped the ship bringing the virus to his family. They became disfigured humans, kept alive by Victor as he worked to find a cure.",English,USA,N/A,https://m.media-amazon.com/images/M/MV5BNGE3ZmFlNWUtZGE5NS00YmNjLThlMDQtYTMzYmFhNDQ3YmE0XkEyXkFqcGdeQXVyODQ5MzQ5Ng@@._V1_SX300.jpg,[],N/A,N/A,N/A,tt13286110,movie,N/A,N/A,N/A,N/A,True,
The Stalking Investigators Movie,2021,N/A,17 Jul 2021,90 min,Action,Graham Abraham,Graham Abraham,"Frankie Imbergamo, Graham Abraham, Paul McGillicuddy, Abella Marie",The heroic and brave team of private investigators must pursue and stop a destructive and evil gang of domestic terrorists that has become a deadly threat to the United States and the government.,English,USA,N/A,N/A,[],N/A,N/A,N/A,tt13153938,movie,N/A,N/A,N/A,N/A,True,
2020: The Movie,2021,N/A,01 Jan 2021,125 min,Drama,Colton Urquhart,Colton Urquhart,Colton Urquhart,,English,United States,N/A,https://m.media-amazon.com/images/M/MV5BOGE0YmYwODctZTk4OC00ZjU2LThlYzUtZjc0ZjY0YWUwMGZjXkEyXkFqcGdeQXVyODg2OTU4MDM@._V1_SX300.jpg,[],N/A,N/A,N/A,tt13409450,movie,N/A,N/A,N/A,N/A,True,
The Men's Group the TV Movie,2021,N/A,27 May 2021,90 min,Drama,"Kenzie Mackenzie Espoir Paterson, Samantha Sammy C. Taylor","Kenzie Mackenzie Espoir Paterson (Writer), Kenzie Mackenzie Espoir Paterson (original creator), Samantha Sammy C. Taylor (Writer), Samantha Sammy C. Taylor (creator)","Kenzie Mackenzie Espoir Paterson, Dustin Nathaniel Davidson, Adam A. Langdon, Isaiah Kallstrom",N/A,English,Canada,N/A,N/A,[],N/A,N/A,N/A,tt13456456,movie,N/A,N/A,N/A,N/A,True,
The Real Movie: Indiecency Rehearsal,2021,N/A,01 Jan 2021,56 min,Documentary,Jody Weinman,Jody Weinman,"Alexandra Brents, Connor Burton, Patrick Chavera, Austin Chunn",N/A,English,USA,N/A,https://m.media-amazon.com/images/M/MV5BOTlkMzkwMDctMDY5OS00MWRkLWI3NDYtMGE1MTljNGM1ZjU0XkEyXkFqcGdeQXVyNjc4NDk5ODY@._V1_SX300.jpg,[],N/A,N/A,N/A,tt13530706,movie,N/A,N/A,N/A,N/A,True,
Antonia: The Movie,2021,N/A,31 Oct 2021,N/A,"Animation, Short","Jl Cyrus, Juanma Rios","Jl Cyrus, Juan Manuel Rios","Myrian Arteaga, Jl Cyrus, Martha Soledad Coronel Digifico","Antonia is a 16 year old teenager with red hair, who after suffering a car accident is saved by Alex, a boy who has just moved to the city. The boy was born in Seabrook but due to work reasons he had to move with his family to the bi",Spanish,Spain,N/A,https://m.media-amazon.com/images/M/MV5BZjA1ZTk2MDQtMjY2Yi00M2RmLTlmZWUtNmE2MjVmMTgyZTgzXkEyXkFqcGdeQXVyMTAyOTg1NDkz._V1_SX300.jpg,[],N/A,N/A,N/A,tt13533880,movie,N/A,N/A,N/A,N/A,True,
The Eric Movie,2021,Unrated,14 Feb 2021,N/A,Adventure,Caleb Abdul Rahman,Caleb Abdul Rahman,"Newton Scappa, Eric Johnson Smith, Deandra Bowling, Jake Alexzader Jr.",N/A,English,USA,N/A,https://m.media-amazon.com/images/M/MV5BYTAwNWM1YzEtMzgwYS00NzZiLWEzZWMtZjdlMTBkYmJkYmVkXkEyXkFqcGdeQXVyMTIxOTcwODYz._V1_SX300.jpg,[],N/A,N/A,N/A,tt13581572,movie,N/A,N/A,N/A,N/A,True,
The Bruised Spring's Teens: The Movie?,2021,N/A,01 Mar 2021,77 min,Comedy,Itai Guberman,Itai Guberman,"Asaf Angel, Zach Cohen, Tomer Shechori","A feature film version of the similarly titled web series. The trials and tribulations of two friends who wanted to make a movie so bad, they failed to notice they were living in one.",English,Australia,N/A,https://m.media-amazon.com/images/M/MV5BZDYwOGUyODYtNjNkNC00MDUzLTk0MzYtZjMxZWI5ODVlNjUwXkEyXkFqcGdeQXVyNTM3NzY2NDA@._V1_SX300.jpg,[],N/A,N/A,N/A,tt13581594,movie,N/A,N/A,N/A,N/A,True,
O! Melodious Movie: Side 1,2021,TV-G,21 Jun 2021,N/A,"Adventure, Comedy, Family, Fantasy, Sci-Fi",Melodious Zach,"Dave Allen (additional story & writing), Edith Meiser (additional dialogue), Melodious Zach (writer and creator), Sue Zy","Melodious Zach, Dave Allen, Sue Zy, Noelle Schoeman",A young man tries to change his best friend from a pet rock back into a human.,English,USA,N/A,https://m.media-amazon.com/images/M/MV5BMDFhNDI5ODYtMDU5OC00NGZhLTg1MzItMDRiNWFjMTRjZGM0XkEyXkFqcGdeQXVyMTE4NjAwNjQy._V1_SX300.jpg,[],N/A,N/A,N/A,tt12439944,movie,N/A,N/A,N/A,N/A,True,
EAS Scenario: The Movie,2021,N/A,26 Nov 2021,N/A,Horror,Santana Spence,N/A,Text-to-Speech Tom,N/A,N/A,N/A,N/A,N/A,[],N/A,N/A,N/A,tt12449616,movie,N/A,N/A,N/A,N/A,True,
The Emissaries Movie,2021,N/A,01 Jul 2021,90 min,"Action, Adventure",Tiffinni Saint Ranae,Tiffinni Saint Ranae,"Robert Wall, Christopher Showerman, Kevin Caliber, Amanda Rushing","A team of scientists hired by the government, are competing with a group of freelance scientists, researchers, and other groups, when one of them decides to recruit college students to help...",English,"USA, UK",N/A,https://m.media-amazon.com/images/M/MV5BODU2NDA4NWUtOTA5NS00NzY2LTg2YjMtMTQyYWY4YWZhMDZmXkEyXkFqcGdeQXVyMTE2NjY1MzQ1._V1_SX300.jpg,[],N/A,N/A,N/A,tt12483500,movie,N/A,N/A,N/A,N/A,True,
The Little Einsteins Reboot Movie,2021,N/A,N/A,N/A,Animation,Travis Copen,Craig Noblin,Kirsten Dickerson,"When June is forced to move away from home, the Einstein gang partner up to find their friend and help her come back home.",English,United States,N/A,https://m.media-amazon.com/images/M/MV5BYTRiOTE0YmMtYjNlOS00YzRlLWI5YjAtNmJhYmRhMzFiNzA2XkEyXkFqcGdeQXVyNjc1MjM1MzI@._V1_SX300.jpg,[],N/A,N/A,N/A,tt12391868,movie,N/A,N/A,N/A,N/A,True,
Untitled Bowling Alley Movie,2021,N/A,01 Mar 2021,N/A,"Short, Comedy",Mike Madigan,Mike Madigan,N/A,"A mysterious character finds herself alone in a bowling alley, trying to find some answers.",N/A,United States,N/A,N/A,[],N/A,N/A,N/A,tt11859182,movie,N/A,N/A,N/A,N/A,True,
"Hungover, Miserable, and Driven Or: How A Couple of Soldiers Decided to Stop Hating Life and Make A Movie",2021,N/A,01 Jan 2021,N/A,Documentary,Eric Pargeon,N/A,"Aaron Bratcher, Jay Butterbaugh, Caity Cassidy","The story of how a handful of active duty U.S. Army Soldiers made the film Pawns' Volition (2020) and how it only costed them, $10,000, Sanity, and their Sobriety.",English,United States,N/A,https://m.media-amazon.com/images/M/MV5BYjJhZDE1OWMtMzUzNi00MDVmLWJkY2YtZmI1MzdkNzljMGQxXkEyXkFqcGdeQXVyNzI0Mzg0OTM@._V1_SX300.jpg,[],N/A,N/A,N/A,tt11863370,movie,N/A,N/A,N/A,N/A,True,
Liston: The Movie,2021,N/A,N/A,N/A,Drama,N/A,Kathrina Miccio,N/A,N/A,English,United States,N/A,N/A,[],N/A,N/A,N/A,tt12098370,movie,N/A,N/A,N/A,N/A,True,
The Helgason Movie,2021,N/A,01 Jul 2021,60 min,Action,Búi Helgason,"Marius K. Armangué (story by), Búi Helgason (screenplay by), Búi Helgason (story by), Búi Helgason, Sejer A. Hester (story by)","Marius K. Armangué, Búi Helgason, Sejer A. Hester","The epic TV-Show hits the big screen in The Helgason Show Movie. To be produced along with the second season of the series, it is expected to be released in July 2021.",English,Denmark,N/A,https://m.media-amazon.com/images/M/MV5BNDdjZTBlNmMtNTMxZC00NmYwLThhYzgtODBhOTFhMWE0OGY5XkEyXkFqcGdeQXVyODQ1Mzg2MjQ@._V1_SX300.jpg,[],N/A,N/A,N/A,tt12158090,movie,N/A,N/A,N/A,N/A,True,
The Big Church Movie,2021,N/A,N/A,N/A,Comedy,Andrzej Bartkowiak,Johnny Mack,N/A,N/A,English,USA,N/A,N/A,[],N/A,N/A,N/A,tt12205350,movie,N/A,N/A,N/A,N/A,True,
The JayShow Movie,2021,N/A,11 Jun 2021,25 min,"Animation, Short, Comedy",Jayevin Abad,Jayevin Abad,"Jayevin Abad, Reed Kelly, Tully Richter, Griffin Deshler","Jay, Reed, and Tully accidentally get stuck in the future. They try to make their way back to the present time, while dealing with an unsuspecting villain and henchmen focused on stealing a powerful chemical from them",English,USA,N/A,https://m.media-amazon.com/images/M/MV5BZGJiODRkYTAtMzQ1Ni00MWNjLTljZmMtYmZjOTVmODExMGI0XkEyXkFqcGdeQXVyODU0NTM4NjU@._V1_SX300.jpg,[],N/A,N/A,N/A,tt12275108,movie,N/A,N/A,N/A,N/A,True,
The Super Animated Movie,2021,Not Rated,30 Jun 2021,98 min,"Animation, Action, Adventure, Comedy",SethDaBruhMoment,"Mandela Abdalla, Austin Nelson","Brian, Mandela Abdalla, Toque Tuber, Locran Baden",N/A,English,"USA, Canada, UK",N/A,https://m.media-amazon.com/images/M/MV5BMGI1ZWU0YzMtMGFmYy00NWQ2LWJkOGItNTNjMGZmNWI2NTZlXkEyXkFqcGdeQXVyMTEzODQxNzQ1._V1_SX300.jpg,[],N/A,N/A,N/A,tt12291978,movie,N/A,N/A,N/A,N/A,True,
Ubiquitas the Movie,2021,N/A,N/A,N/A,"Action, Fantasy, Horror",Riccardo Musardo,"Danny Galati, Gaspare Marconetti, Riccardo Musardo","Ilaria D'Angelo, Angelo Losito, Chiara Di Maggio",N/A,"Italian, English",Italy,N/A,N/A,[],N/A,N/A,N/A,tt11272796,movie,N/A,N/A,N/A,N/A,True,
Black & White Christmas Movie,2021,N/A,05 Nov 2021,N/A,"Comedy, Drama",Daniel L. Wolff,Daniel L. Wolff,"Brenna M. Wolff, Melinda Simonsen, Sheila Young Jenkinson, Daniel L. Wolff",An outspoken young woman must decide how to deal with the upcoming holidays as her world comes crashing down around her.,English,USA,N/A,https://m.media-amazon.com/images/M/MV5BYmZlMGVlNzUtMDhmYy00OTdhLWI0MjEtOTJlNDMxMTQ0NzUyXkEyXkFqcGdeQXVyOTQzNzA2NjM@._V1_SX300.jpg,[],N/A,N/A,N/A,tt11344704,movie,N/A,N/A,N/A,N/A,True,
Tom Six and the Insanity of Making Another Movie,2021,N/A,01 Aug 2021,N/A,Documentary,Tom Six,Tom Six,"Tom Six, Ilona Six","A unique and radical documentary about indie film dictator Tom Six, his (in)famous pop culture trilogy ""The Human Centipede"" and the enormous battle to get his newest movie ""The Onania Club"" released.","Dutch, English","United States, Netherlands",N/A,https://m.media-amazon.com/images/M/MV5BNGM5ODNiODMtZjcwOC00MGUzLThkZjUtZmZjNzEwMzVkMzkzXkEyXkFqcGdeQXVyMTU5NDUwMzE@._V1_SX300.jpg,[],N/A,N/A,N/A,tt3384930,movie,N/A,N/A,N/A,N/A,True,
Si Juki: The Movie - Harta Pulau Monyet,2021,TV-PG,N/A,N/A,"Animation, Adventure, Comedy",Faza Meonk,N/A,"Faza Meonk, Indro Warkop, Wizzy",N/A,Indonesian,Indonesia,N/A,https://m.media-amazon.com/images/M/MV5BMjdhOGM0YzQtNTQyMC00MmQ2LWE3NTktYmRmMmUyNjEyZDk0XkEyXkFqcGdeQXVyNzY4NDQzNTg@._V1_SX300.jpg,[],N/A,N/A,N/A,tt10640084,movie,N/A,N/A,N/A,N/A,True,
The Simpsons Movie 2,2021,N/A,26 May 2021,N/A,N/A,David Silverman,"Matt Groening (screenplay), Al Jean (screenplay), Ian Maxtone-Graham (screenplay), David Mirkin (screenplay), Mike Reiss (screenplay), Mike Scully (screenplay), Matt Selman (screenplay), Jon Vitti (screenplay)","Nancy Cartwright, Julie Kavner, Harry Shearer, John Flanagan",N/A,N/A,N/A,N/A,https://m.media-amazon.com/images/M/MV5BMzkyODZkYjYtMzJjOC00NTU2LWJlZTMtOGE3MTk2NzMwZjZkXkEyXkFqcGdeQXVyODk1MjAxNzQ@._V1_SX300.jpg,[],N/A,N/A,N/A,tt10071176,movie,N/A,N/A,N/A,N/A,True,
Cars and Coffee Movie,2021,Not Rated,05 Apr 2021,N/A,"Documentary, Short, Action",Kathy Jean,Kathy Jean,Kathy Jean,People gather to celebrate cars and coffee.,N/A,United States,N/A,https://m.media-amazon.com/images/M/MV5BZmM4ODA3NDAtM2NmOC00Njk0LWFiZGUtNGZkMDM1YTIwZmU2XkEyXkFqcGdeQXVyMTQxNTQ5NDc@._V1_SX300.jpg,[],N/A,N/A,N/A,tt10275878,movie,N/A,N/A,N/A,N/A,True,
Vecinos: The Movie,2021,N/A,24 Apr 2021,N/A,Romance,Alex Avila,Rupert Reyes,"Rupert Reyes, Alma Chapa Moore, Karinna Perez",N/A,English,United States,N/A,https://m.media-amazon.com/images/M/MV5BMTMxYTE5YTEtM2M4Zi00MDU1LTlhZDEtNzcwZGE5ZmZhYzk3XkEyXkFqcGdeQXVyODgwMTIxMDQ@._V1_SX300.jpg,[],N/A,N/A,N/A,tt10333474,movie,N/A,N/A,N/A,N/A,True,
