Title,Year,Rated,Released,Runtime,Genre,Director,Writer,Actors,Plot,Language,Country,Awards,Poster,Ratings,Metascore,imdbRating,imdbVotes,imdbID,Type,DVD,BoxOffice,Production,Website,Response,totalSeasons
PAW Patrol: The Movie,2021,G,20 Aug 2021,86 min,"Animation, Action, Adventure",Cal Brunker,"Billy Frolick, Cal Brunker, Bob Barlen","Tyler Perry, Ron Pardo, Will Brisbin",Ryder and the PAW Patrol pups are called to Adventure City in order to stop the recently-elected Mayor Humdinger from wreaking havoc.,English,"Canada, United States",3 wins & 4 nominations total,https://m.media-amazon.com/images/M/MV5BYTJmM2Q1YTMtZjQ1Yi00NGYzLTlhZWEtOTc1NGJkMjYzMTQ4XkEyXkFqcGc@._V1_SX300.jpg,"[{'Source': 'Internet Movie Database', 'Value': '6.1/10'}, {'Source': 'Rotten Tomatoes', 'Value': '82%'}, {'Source': 'Metacritic', 'Value': '50/100'}]",50,6.1,"8,969",tt11832046,movie,N/A,"$40,127,371",N/A,N/A,True,
The Loud House Movie,2021,TV-Y7,20 Aug 2021,83 min,"Animation, Adventure, Comedy",Dave Needham,"Kevin Sullivan, Chris Viscardi, Chris Savino","Asher Bishop, David Tennant, Michelle Gomez","With his parents and all 10 sisters in tow, Lincoln Loud heads to Scotland and learns that royalty runs in the family in this global musical journey.",English,"United States, Philippines, Austria",2 nominations,https://m.media-amazon.com/images/M/MV5BMzA4NmQ4ZjUtNzEwZS00MTY5LTk2ZmYtMWZhNDdiOTAwYTc5XkEyXkFqcGc@._V1_SX300.jpg,"[{'Source': 'Internet Movie Database', 'Value': '6.1/10'}]",N/A,6.1,"3,042",tt6714432,movie,N/A,N/A,N/A,N/A,True,
2gether: The Movie,2021,N/A,11 Nov 2021,107 min,"Comedy, Musical, Romance","Noppharnach Chaiwimol, Kanittha Kwanyu, Weerachit Thongjila","Bee Pongsate Lucksameepong, Pratchaya Thavornthummarat, Kornphom Niyomsilp","Vachirawit Chivaaree, Metawin Opas-Iamkajorn, Sattabut Laedeke",Tine wants to get rid of a gay admirer so he finds a fake boyfriend: Sarawat. The two become close and intense emotions soon erupt. As Tine and Sarawat enter the second year of their relationship.,Thai,Thailand,N/A,https://m.media-amazon.com/images/M/MV5BODUwYmFmOTAtMDJkZS00NDkyLWI3NzQtY2RjMzg4ODhjNjI0XkEyXkFqcGc@._V1_SX300.jpg,"[{'Source': 'Internet Movie Database', 'Value': '6.6/10'}]",N/A,6.6,"2,353",tt14296268,movie,N/A,N/A,N/A,N/A,True,
A Cop Movie,2021,R,05 Nov 2021,107 min,"Documentary, Action, Crime",Alonso Ruizpalacios,"David Gaitán, Alonso Ruizpalacios","Mónica Del Carmen, Raúl Briones, María Teresa Hernández Cañas",Two professional actors undergo an immersive process to find out what it takes to be a cop in Mexico City.,Spanish,Mexico,7 wins & 20 nominations,https://m.media-amazon.com/images/M/MV5BMGFkNDkwMDktNTAzYi00MWFhLWExNTMtZDM4ZTY3MzQyODIzXkEyXkFqcGc@._V1_SX300.jpg,"[{'Source': 'Internet Movie Database', 'Value': '7.0/10'}, {'Source': 'Rotten Tomatoes', 'Value': '95%'}, {'Source': 'Metacritic', 'Value': '76/100'}]",76,7.0,"2,229",tt14035242,movie,N/A,N/A,N/A,N/A,True,
Shatagni - The Movie,2021,N/A,19 Nov 2021,N/A,"Action, Crime, Thriller",Lv Siva,Abhiram Reddy Dasari,"Abhiram Dasari, Abhiram Reddy Dasari, Swathi Mandal",The story of the film was based on the real incidents that are happening on social media in recent times. Story revolves around the victims of a gang who morphs pictures of young girls on social media and earns money out of it.,Telugu,India,N/A,https://m.media-amazon.com/images/M/MV5BMTIxMzQwOWYtOTAxNC00OGE3LTkzOWYtMzJhNzEyNWM4NGE1XkEyXkFqcGdeQXVyMTI2MzEwMDQx._V1_SX300.jpg,[],N/A,N/A,"2,007",tt14650250,movie,N/A,N/A,N/A,N/A,True,
Blackpink: The Movie,2021,TV-G,04 Aug 2021,100 min,"Documentary, Music","Su Yee Jung, Oh Yoon-dong","Chung Justine, Lee Mizi","Blackpink, Kim Jisoo, Jennie Kim","Commemorating the fifth anniversary of the debut of the South Korean girl group BLACKPINK featuring interviews with the four members: Jisoo, Jennie, Rosé, and Lisa, and live performances from ""The Show"" and ""In Your Area World Tour"".",Korean,South Korea,N/A,https://m.media-amazon.com/images/M/MV5BNzRmZjBlYmItN2Q1Mi00ZjczLTkzZDMtOGE3MDVmZjAzMTczXkEyXkFqcGc@._V1_SX300.jpg,"[{'Source': 'Internet Movie Database', 'Value': '6.8/10'}]",N/A,6.8,"1,622",tt14880612,movie,N/A,N/A,N/A,N/A,True,
Untitled Horror Movie,2021,Not Rated,15 Jun 2021,87 min,"Comedy, Horror",Nick Simon,"Luke Baines, Nick Simon","Luke Baines, Darren Barnet, Timothy Granaderos","A comedy about making a horror movie. When six co-stars learn their hit TV show is about to be canceled, they decide to shoot their own film, unintentionally summoning a spirit with an affinity for violence.",English,United States,N/A,https://m.media-amazon.com/images/M/MV5BYzgyNmFmMDUtMjc5OC00OTVjLWI2NzUtMzRhNWI4MmM2MTk1XkEyXkFqcGc@._V1_SX300.jpg,"[{'Source': 'Internet Movie Database', 'Value': '4.8/10'}, {'Source': 'Rotten Tomatoes', 'Value': '82%'}]",N/A,4.8,"1,448",tt12624584,movie,N/A,N/A,N/A,N/A,True,
The Balcony Movie,2021,N/A,30 Nov 2022,100 min,Documentary,Pawel Lozinski,Pawel Lozinski,N/A,"Composed from the conversations that the director holds with people passing by in the street under his Warsaw apartment, each story in 'The Balcony Movie' is unique and deals with the way we try to cope with life as individuals. A...","English, Russian, Polish",Poland,8 wins & 9 nominations,https://m.media-amazon.com/images/M/MV5BYmQ0Y2NlYmMtOWUxMy00NTQ4LTgwZmYtZTAxM2IzNzQ1MmEzXkEyXkFqcGc@._V1_SX300.jpg,"[{'Source': 'Internet Movie Database', 'Value': '7.5/10'}, {'Source': 'Rotten Tomatoes', 'Value': '100%'}]",N/A,7.5,"1,301",tt15180952,movie,N/A,N/A,N/A,N/A,True,
a-ha: The Movie,2021,N/A,03 Sep 2021,109 min,"Documentary, Biography, Music","Thomas Robsahm, Aslaug Holm",Thomas Robsahm,"a-ha, Morten Harket, Pål Waaktaar","Follows the band on tour, telling the full story of how three young men followed their impossible dream of becoming Norwegian pop stars. When Take On Me reached number 1 on Billboard in the US in 1985 the dream came true. Or did it?","Norwegian, English, German","Norway, Germany",3 nominations,https://m.media-amazon.com/images/M/MV5BNjg1NDI4NTctMDk4Yi00MjgyLWEwOGYtZTY3YTM3MjE4NWE0XkEyXkFqcGc@._V1_SX300.jpg,"[{'Source': 'Internet Movie Database', 'Value': '7.0/10'}, {'Source': 'Rotten Tomatoes', 'Value': '81%'}, {'Source': 'Metacritic', 'Value': '56/100'}]",56,7.0,"1,295",tt10851414,movie,N/A,"$4,258",N/A,N/A,True,
Super Heroes: The Movie,2021,N/A,02 Feb 2021,80 min,Romance,Wesley Wittkamper,"Jeff Gass, Wesley Wittkamper","Mark Aston, Geoffrey Baumann, Judi Beecher","After a bad breakup, Wonderful Woman and Superbman must work together with the super crew to prevent world domination by an invincible supervillain from the 5th dimension named Bob. Shot in 1998, this superhero parody stars Lisa G...",English,N/A,N/A,https://m.media-amazon.com/images/M/MV5BMDdmOTM5NmQtYTNjNC00MDE2LWFiZGYtNmNhZTE0ZTY2ZWE2XkEyXkFqcGdeQXVyMTI5NjMwMDI3._V1_SX300.jpg,"[{'Source': 'Internet Movie Database', 'Value': '7.3/10'}]",N/A,7.3,"1,242",tt14087490,movie,N/A,N/A,N/A,N/A,True,
Animals on the Loose: A You vs. Wild Movie,2021,TV-PG,16 Feb 2021,90 min,Adventure,Ben Simms,"Robert Buchta, Bear Grylls, Delbert Shoopman",Bear Grylls,"The protective fence surrounding a wildlife sanctuary has mysteriously suffered a breach. Bear is called in to help rescue a mischievous baboon, track down a hungry lion, and fix the fence before any more animals get out.",English,United States,N/A,https://m.media-amazon.com/images/M/MV5BNjA5MGFhYmYtYTBkYS00NjYzLWFkZjgtYWNiNmE5ZTFiNDAwXkEyXkFqcGc@._V1_SX300.jpg,"[{'Source': 'Internet Movie Database', 'Value': '5.8/10'}]",N/A,5.8,"1,066",tt13853720,movie,N/A,N/A,N/A,N/A,True,
The Super Bob Einstein Movie,2021,TV-MA,28 Dec 2021,75 min,"Documentary, Biography, Comedy",Danny Gold,"Danny Gold, Michael Mayhew","Albert Brooks, John Byner, Larry David","Follows the life of the late actor, writer and producer Bob Einstein, featuring some of his greatest comedic contributions.",English,United States,N/A,https://m.media-amazon.com/images/M/MV5BZTAyODYzMjAtNWNjYy00Njc5LWE0OWYtZGU0YzkyY2VjZDY5XkEyXkFqcGc@._V1_SX300.jpg,"[{'Source': 'Internet Movie Database', 'Value': '7.3/10'}]",N/A,7.3,"1,036",tt16533296,movie,N/A,N/A,N/A,N/A,True,
The House of Flowers: The Movie,2021,TV-MA,23 Jun 2021,86 min,"Comedy, Drama",Manolo Caro,"Manolo Caro, Gabriel Nuncio","Cecilia Suárez, Aislinn Derbez, Dario Yazbek Bernal",The De La Mora siblings concoct a mischievous plan to break into their old family home to retrieve a hidden treasure of significant importance.,Spanish,Mexico,N/A,https://m.media-amazon.com/images/M/MV5BNzYxMzU0MDEtYWRjMi00OTQ2LTk3YmYtMDBhMzUyNGZkZTcwXkEyXkFqcGc@._V1_SX300.jpg,"[{'Source': 'Internet Movie Database', 'Value': '5.5/10'}]",N/A,5.5,"1,032",tt14549558,movie,N/A,N/A,N/A,N/A,True,
Christmas Movie Magic,2021,N/A,07 Dec 2021,87 min,"Comedy, Drama, Romance",Robert Vaughn,"James S. Blakeman, Rickie Castaneda, Caitlin English","Holly Deveaux, Drew Seeley, Jill Frappier","Follows Alli Blakeman, an entertainment writer who learns that movie magic isn't always just on-screen after she discovers the mysterious origins of a classic Christmas movie.",English,Canada,4 nominations,https://m.media-amazon.com/images/M/MV5BN2FlMWI2M2QtOTM2Yy00YWI2LWJiZjItN2I2ZDAxZjU1MDA0XkEyXkFqcGc@._V1_SX300.jpg,"[{'Source': 'Internet Movie Database', 'Value': '6.3/10'}]",N/A,6.3,713,tt15515522,movie,N/A,N/A,N/A,N/A,True,
Wendy Williams: The Movie,2021,TV-14,30 Jan 2021,88 min,"Biography, Drama",Darren Grant,"Leigh Davenport, Scarlett Lacey","Jamall Johnson, Ciera Payton, Liza Huget","Follows the highs and lows Wendy has experienced throughout the years, from her scrappy upstart days in urban radio to the success of her own syndicated talk show.",English,United States,1 win & 1 nomination,https://m.media-amazon.com/images/M/MV5BYmE0NDQxYzUtNTZkMi00MzM1LWIxNTEtYzEwZTFkMmM1ZjNkXkEyXkFqcGc@._V1_SX300.jpg,"[{'Source': 'Internet Movie Database', 'Value': '5.6/10'}]",N/A,5.6,629,tt13084756,movie,N/A,N/A,N/A,N/A,True,
Nussa: The Movie,2021,TV-G,14 Oct 2021,107 min,"Animation, Adventure, Comedy",Bony Wirasmono,"M. Nurman Wardi, Widya Arifianti, Bony Wirasmono","Muzakki Ramdhan, Aysha Razaana Ocean Fajar, Fenita Arie",Nussa's life changed when he met a new friend who was much more liked by his friends than himself.,Indonesian,Indonesia,2 wins & 4 nominations,https://m.media-amazon.com/images/M/MV5BZWZiODkxNjgtYmQ2OS00YmNlLThhZDMtMzNiN2Q5OGYzMzE2XkEyXkFqcGdeQXVyMTEzMTI1Mjk3._V1_SX300.jpg,"[{'Source': 'Internet Movie Database', 'Value': '7.2/10'}]",N/A,7.2,559,tt11710090,movie,N/A,N/A,N/A,N/A,True,
"Hello, Stranger: The Movie",2021,N/A,12 Feb 2021,101 min,"Comedy, Romance",Dwein Baltazar,"Daniel Saniana, Patrick John Valencia","Tony Labrusca, JC Alcantara, Vivoree Esclito","Xavier and Mico join a writing camp, where they get to know each other more. But with their friends and other people around them twist and turn them in different directions, will they be strangers no more or strangers again?",Filipino,Philippines,2 nominations,https://m.media-amazon.com/images/M/MV5BYmEwMjJhNWItMjJjNS00ODU4LWI5MzUtZTAwNDUwY2E0ZmU0XkEyXkFqcGc@._V1_SX300.jpg,"[{'Source': 'Internet Movie Database', 'Value': '6.9/10'}]",N/A,6.9,549,tt12951932,movie,N/A,N/A,N/A,N/A,True,
Gameboys: The Movie,2021,TV-14,30 Jul 2021,107 min,"Comedy, Drama, Romance",Ivan Andrew Payawal,"Ash Malanum, Jun Lana","Kokoy De Santos, Elijah Canlas, Adrianna So","Gamers turned lovers Cairo and Gavreel spend time together a few weeks before Cairo returns to his province. Their relationship is tested as they have to deal with distance, the pandemic, fate and circumstance.","English, Tagalog, Filipino","Philippines, Japan",9 nominations,https://m.media-amazon.com/images/M/MV5BMDkwYzQwN2UtYjExOS00MzZlLWI0NDgtZGI2NjI5ZDM2YTJkXkEyXkFqcGdeQXVyNTI5NjIyMw@@._V1_SX300.jpg,"[{'Source': 'Internet Movie Database', 'Value': '7.7/10'}]",N/A,7.7,453,tt14813878,movie,N/A,N/A,N/A,N/A,True,
Bai Ivan - The Movie,2021,N/A,12 Nov 2021,96 min,Comedy,Nikolai Pavlov,Dimitar Kiriazov,"Dimitar Kiriazov, Silvia Yordanova, Nikolai Garabedian","A comedy continuing the ""Vanka's World"" mini-series. Bai Ivan wins the chance to participate in a TV show and starts his journey to fame. He will go through many adventures in his attempt to win the big prize.",Bulgarian,Bulgaria,N/A,https://m.media-amazon.com/images/M/MV5BMWM2MWY2ZTgtZjQwMS00NTY4LTllNTYtM2ZkMzJhYWY5NWQ4XkEyXkFqcGdeQXVyOTA1MDE3OA@@._V1_SX300.jpg,"[{'Source': 'Internet Movie Database', 'Value': '5.3/10'}]",N/A,5.3,416,tt15381956,movie,N/A,N/A,N/A,N/A,True,
Fate/Grand Order The Movie Divine Realm Of The Round Table: Camelot Paladin; Agateram,2021,N/A,15 May 2021,96 min,"Animation, Action, Drama",Kazuto Arai,"Kinoko Nasu, Ukyô Kodachi, Kazuto Arai","Robbie Daymond, Mamoru Miyano, Nobunaga Shimazaki","Part two of Fate/Grand Order: Shinsei Entaku Ryouiki Camelot - Wandering; Agateram; an adaptation of the the Sixth Holy Grail War, The Sacred Round Table Realm Camelot Singularity of Fate/Grand Order.",Japanese,Japan,N/A,https://m.media-amazon.com/images/M/MV5BYWQyYTliNWQtZmM0NS00MTg2LTg1MzgtOTc1YTNmZTliNDYxXkEyXkFqcGc@._V1_SX300.jpg,"[{'Source': 'Internet Movie Database', 'Value': '6.8/10'}]",N/A,6.8,328,tt13997358,movie,N/A,N/A,N/A,N/A,True,
"Caution, Hazardous Wife: The Movie",2021,N/A,19 Mar 2021,119 min,"Action, Adventure, Drama",Tôya Satô,"Kazuki Kaneshiro, Yukiko Manabe","Haruka Ayase, Rei Dan, Fumiyo Kohinata",From a TV serial superspy Nami becomes amnesiac and joins her partner investigating dastardly Russians and corrupt corporations. The climax on a research ship ties the show together wonderfully. Is Nami really amnesiac? Watch it.,"Japanese, Russian, English",Japan,N/A,https://m.media-amazon.com/images/M/MV5BMDI4MTE0NjMtMzhiOS00NWFkLTgzMzAtZTRhMzFjNjYyNWM2XkEyXkFqcGc@._V1_SX300.jpg,"[{'Source': 'Internet Movie Database', 'Value': '5.7/10'}]",N/A,5.7,304,tt11477842,movie,N/A,N/A,N/A,N/A,True,
Killer Movie: Director's Cut,2021,N/A,27 Aug 2021,80 min,"Comedy, Horror, Mystery",Jeff Fisher,Jeff Fisher,"Robert Buckley, Nestor Carbonell, Kaley Cuoco","In 2008, a reality television crew was dispatched to a small town in the United States to cover the story of an underdog high school hockey team on their way to the state finals. One by one, members of the cast and crew went missing.","English, American Sign ",United States,N/A,https://m.media-amazon.com/images/M/MV5BNzc0MTgxNDktNjJhMi00ZTRlLWE3YmEtYmFmMTc2NDc3OWY5XkEyXkFqcGdeQXVyODM4MjYxMA@@._V1_SX300.jpg,"[{'Source': 'Internet Movie Database', 'Value': '4.6/10'}]",N/A,4.6,300,tt14629580,movie,N/A,N/A,N/A,N/A,True,
Pornographer the Movie: Playback,2021,Unrated,26 Feb 2021,107 min,Romance,Kôichirô Miki,Kôichirô Miki,"Kenta Izuka, Terunosuke Takezai, Yoshida Munehiro","Kijima and Kuzumi, showing the problems they face as they try to move forward in their lives, and how they drift apart while still yearning to be together. A story of love and life, and fantasies and failures of a novelist and his...",Japanese,Japan,N/A,https://m.media-amazon.com/images/M/MV5BODQ2ZjEzNDMtOGExYS00MzRjLWI2NDAtZjA0MjJjZjAwMGMwXkEyXkFqcGc@._V1_SX300.jpg,"[{'Source': 'Internet Movie Database', 'Value': '8.3/10'}]",N/A,8.3,287,tt13213122,movie,N/A,N/A,N/A,N/A,True,
Steve McQueen: The Lost Movie,2021,N/A,01 Jan 2021,87 min,"Documentary, Biography, Sport",Alex Rodger,Alex Rodger,"Steve McQueen, James Garner, John Frankenheimer","A car racing movie that Hollywood legend and avid racing fan Steve McQueen started production on in the mid-1960s as his passion project, but never completed.",English,United Kingdom,N/A,https://m.media-amazon.com/images/M/MV5BMGJkZjNlNjYtYTBmZC00ZjZiLWEwZjQtMDU3MGIxOWEwNjUzXkEyXkFqcGc@._V1_SX300.jpg,"[{'Source': 'Internet Movie Database', 'Value': '6.7/10'}]",N/A,6.7,269,tt12381962,movie,N/A,N/A,N/A,N/A,True,
Tersanjung: The Movie,2021,TV-14,01 Apr 2021,114 min,"Drama, Romance","Pandu Adjisurya, Hanung Bramantyo, Nur Jihat Hisyam","Hanung Bramantyo, Pandu Adjisurya","Clara Bernadeth, Giorgino Abraham, Kevin Ardilova","Yura (Clara Bernadeth) faces the complicated love triangle between Oka (Kevin Ardilio) and Christian (Giorgino Abraham). The story of dreams, romance, and emotions raging together.",Indonesian,Indonesia,1 win & 1 nomination total,https://m.media-amazon.com/images/M/MV5BZDBhZGRlM2MtODM0Zi00YzZmLTk5YWYtNjBlOWY5NWZkZTQxXkEyXkFqcGc@._V1_SX300.jpg,"[{'Source': 'Internet Movie Database', 'Value': '5.9/10'}]",N/A,5.9,251,tt11668994,movie,N/A,N/A,N/A,N/A,True,
Revue Starlight the Movie,2021,N/A,04 Jun 2021,120 min,"Animation, Action, Drama",Tomohiro Furukawa,Tatsuto Higuchi,"Momoyo Koyama, Suzuko Mimori, Haruki Iwata","Starlight - This is a story of a far off star, a long time ago, and in the distant future. Two young girls, captivated by the glamour of the performance, exchange promises: ""We'll become stars."" ""I'll wait for you on stage.""",Japanese,Japan,1 nomination,https://m.media-amazon.com/images/M/MV5BNWQyYjc1MmYtNThkNC00ODMyLTllZWQtMmMwODRkYmE3MzU5XkEyXkFqcGc@._V1_SX300.jpg,"[{'Source': 'Internet Movie Database', 'Value': '7.8/10'}]",N/A,7.8,214,tt13593042,movie,N/A,N/A,N/A,N/A,True,
The Pedal Movie,2021,N/A,30 Apr 2021,142 min,Documentary,"Michael Lux, Daniel Orkin","Michael Lux, Daniel Orkin","Oliver Ackermann, Steve Albini, Juan Alderete","A Documentary about the history, culture, and sound of guitar effects pedals, told by the builders who build them and the artists who use them.",English,United States,1 win & 1 nomination,https://m.media-amazon.com/images/M/MV5BZDgwMWRmN2QtMzA1My00NGU4LTg5YWEtNTllZWVmMjg1ODE1XkEyXkFqcGdeQXVyNDg3NzA2OTg@._V1_SX300.jpg,"[{'Source': 'Internet Movie Database', 'Value': '7.2/10'}]",N/A,7.2,190,tt11811310,movie,N/A,N/A,N/A,N/A,True,
L.O.L. Surprise: The Movie,2021,TV-Y,08 Oct 2021,47 min,"Animation, Action, Drama","Alex Kamb, Joan Mok, Lauren Ciaravalli",Julia Mayfield Prescott,"Ashley Angione, Sarah J. Bartholomew, Jessica Ruth Bell","Queen Bee is making a movie with her big sister, Royal Bee. But the big premiere is happening tonight. Will the crew finish their movie in time? Find out in this one-of-a-kind fantasy, action, spooky, and sci-fi western adventure.",English,United States,N/A,https://m.media-amazon.com/images/M/MV5BYjg1ZGMwMjgtNzkwYi00ZWRhLTljZjktMWFkNjk2NWJkODA1XkEyXkFqcGc@._V1_SX300.jpg,"[{'Source': 'Internet Movie Database', 'Value': '3.6/10'}]",N/A,3.6,176,tt15576986,movie,N/A,N/A,N/A,N/A,True,
Signal: The Movie,2021,N/A,02 Apr 2021,122 min,Action,Hajime Hashimoto,Kôsuke Nishi,"Kentarô Sakaguchi, Kazuki Kitamura, Michiko Kichise","Story continues from the Japanese Signal drama series. In 2021, a limousine taxi driver causes an accident on a highway and a high-level government official dies in the accident...",Japanese,Japan,N/A,https://m.media-amazon.com/images/M/MV5BN2M0MGU2NGQtMjllNy00MjgwLWJhZTMtOTM0NTRjODY5MTRmXkEyXkFqcGc@._V1_SX300.jpg,"[{'Source': 'Internet Movie Database', 'Value': '5.4/10'}]",N/A,5.4,174,tt13529316,movie,N/A,N/A,N/A,N/A,True,
99.9 Criminal Lawyer: The Movie,2021,N/A,30 Dec 2021,120 min,"Comedy, Crime, Drama",N/A,N/A,"Jun Matsumoto, Teruyuki Kagawa, Hana Sugisaki","Hiroto Miyama works with rookie lawyer Honoka Kono on a team that specializes with criminal cases for Madarame Law Firm. Atsuhiro Sada has become the director of the law firm. One day, the law firm receives a request about a case ...",Japanese,Japan,N/A,https://m.media-amazon.com/images/M/MV5BZjVkZThhOGQtZTY3My00ZTZmLThlNTgtY2VlNDQyYzE1YTg2XkEyXkFqcGc@._V1_SX300.jpg,[],N/A,N/A,164,tt15434284,movie,N/A,N/A,N/A,N/A,True,
Discord: The Movie,2021,N/A,23 Jul 2021,6 min,"Short, Adventure, Sci-Fi",Finn Keenan,"Alexander Rose, Noé Sato","Danny DeVito, Awkwafina, Jimmy Donaldson","Discord: The Movie is a movie about Discord and what Discord means to us, to you, and to people everywhere. Whether you're here to hang, chat, talk, study, or love eggs, all you have to do is imagine a place on Discord.",English,United States,N/A,https://m.media-amazon.com/images/M/MV5BNTkwY2NkNTQtY2YxZS00NjQ0LWJhZDEtMjUzYjUyY2NiNjJjXkEyXkFqcGdeQXVyMzkxMjk1MzU@._V1_SX300.jpg,"[{'Source': 'Internet Movie Database', 'Value': '6.1/10'}]",N/A,6.1,130,tt15101430,movie,N/A,N/A,N/A,N/A,True,
He's Into Her: The Movie Cut,2021,N/A,22 Nov 2021,199 min,"Comedy, Romance",Chad Vidanes,"Maxine Lat Calibuso, Charisse Bayona, Dip B. Mariposque","Belle Mariano, Donny Pangilinan, Rhys Miguel Eugenio","A spunky teenage girl from Mindoro, moves to Manila to live with her estranged father and study in a prestigious school. She clashes with basketball varsity captain, unaware that their one-upmanship will blossom into something bea...","Tagalog, Filipino",Philippines,N/A,https://m.media-amazon.com/images/M/MV5BMzMzODc0ZTUtMjQ1MC00MDAyLTljNTEtMjZhMDVmOWIwNzRhXkEyXkFqcGc@._V1_SX300.jpg,[],N/A,N/A,113,tt16175706,movie,N/A,N/A,N/A,N/A,True,
No Strings the Movie,2021,N/A,12 Feb 2021,81 min,Romance,Rebecca Ugo,Rebecca Ugo,"Racheal Ihim, Daniel Lopez, Malik Julien","A young girl is saved from child trafficking but loses her mother in the process. She carries resentment and hate for the world, so she takes her anger into relationships. To avenge her mom's death, she goes on dates with guys spe...",English,United States,N/A,https://m.media-amazon.com/images/M/MV5BZWEzMjczMjMtZDMzNy00MzkzLTlkYjAtZmQxZTY4NzEyNTkwXkEyXkFqcGc@._V1_SX300.jpg,"[{'Source': 'Internet Movie Database', 'Value': '5.8/10'}]",N/A,5.8,95,tt11773084,movie,N/A,N/A,N/A,N/A,True,
Sam & Mattie Make a Zombie Movie,2021,N/A,06 Apr 2021,1 min,Documentary,"Jesse Suchmann, Robert Carnevale",N/A,"Sam Suchmann, Mattie Zufelt, Peter Farrelly","Sam and Mattie, two badass best friends with Down syndrome, rally the entire town of Providence RI to help them storyboard, script, produce, cast, and star in their own dream movie: 'Spring Break Zombie Massacre.'",English,United States,1 win,https://m.media-amazon.com/images/M/MV5BOTY0OWMzYjAtNGRlMC00ZWI3LWIxY2MtYmE2YTAyYjM4ODcwXkEyXkFqcGc@._V1_SX300.jpg,"[{'Source': 'Internet Movie Database', 'Value': '7.5/10'}, {'Source': 'Rotten Tomatoes', 'Value': '100%'}]",N/A,7.5,91,tt10613030,movie,N/A,N/A,N/A,N/A,True,
Adit Sopo Jarwo: The Movie,2021,TV-PG,30 Apr 2021,82 min,"Animation, Comedy, Drama","Hanung Bramantyo, Eki N.F.","Anto Malaya, Beni Susanto","Muzakki Ramdhan, Musripah, Hanung Bramantyo","On the way to Jogjakarta, Adit was separated from his parents. His journey taught Adit the true meaning of friendship.",Indonesian,Indonesia,1 nomination,https://m.media-amazon.com/images/M/MV5BMjBkODE5Y2EtODgzOS00ZmU1LTg1YWItNDVjMzdkZDZkNWJkXkEyXkFqcGdeQXVyMTI4MjIyNTM1._V1_SX300.jpg,"[{'Source': 'Internet Movie Database', 'Value': '7.1/10'}]",N/A,7.1,91,tt13465228,movie,N/A,N/A,N/A,N/A,True,
Backwoods Bubba (Full movie),2021,N/A,N/A,N/A,Horror,James B. Thomasson,"Rebecca Rinehart, James B. Thomasson","Julie Anne Prescott, Angel Nichole Bradford, Heather Harlow",Bubba Wayne Bundy along with the help of his brother John Edward Bundy are two madman who gets off on kidnapping woman and dressing them up.,N/A,United States,N/A,https://m.media-amazon.com/images/M/MV5BYmNhMDI4NzItNzdlNi00NzIyLThjZmQtZDdjZDFhMTBkMjA2XkEyXkFqcGdeQXVyOTgzNTAzNDA@._V1_SX300.jpg,"[{'Source': 'Internet Movie Database', 'Value': '5.2/10'}]",N/A,5.2,80,tt11609250,movie,N/A,N/A,N/A,N/A,True,
Lupin's Daughter: The Movie,2021,N/A,15 Oct 2021,110 min,"Action, Comedy, Crime",Hideki Takeuchi,"Yûichi Tokunaga, Dai Yokozeki","Hiroshi Fujioka, Kyôko Fukada, Tatsuya Gashûin","The Mikumo family attempts their biggest heist to date For that heist, the family travels abroad.",Japanese,Japan,N/A,https://m.media-amazon.com/images/M/MV5BN2MzNmRkZjMtYTI3MS00ZWJlLWIzZjgtMzg4NmRiNzM2ZWFkXkEyXkFqcGc@._V1_SX300.jpg,[],N/A,N/A,79,tt15033850,movie,N/A,N/A,N/A,N/A,True,
Fries! The Movie,2021,N/A,N/A,83 min,Documentary,"Michael Steed, Gillian Brown",N/A,"Chrissy Teigen, Ana Cornier, Lucas Kwan Peterson",The universal love for fried potatoes.,English,United States,N/A,https://m.media-amazon.com/images/M/MV5BOWI0NDA5ZTktMGQ3MS00YzM2LWI3NjctNmE3OTkwZGM4Zjg5XkEyXkFqcGdeQXVyOTUzNjEwMjU@._V1_SX300.jpg,"[{'Source': 'Internet Movie Database', 'Value': '5.8/10'}]",N/A,5.8,71,tt9435970,movie,N/A,N/A,N/A,N/A,True,
2021 MTV Movie & TV Awards,2021,N/A,16 May 2021,N/A,N/A,Ryan Polito,"Steven Murphy, Agathe Panaretos, Nefetari Spencer","Kathryn Hahn, Madelyn Cline, Sacha Baron Cohen",N/A,English,United States,N/A,https://m.media-amazon.com/images/M/MV5BZGU5NmU0ZTMtMGQzMi00NDgzLTkyY2ItNzFmNmY3NWIwMmVhXkEyXkFqcGc@._V1_SX300.jpg,[],N/A,N/A,70,tt14489294,movie,N/A,N/A,N/A,N/A,True,
A Spy Movie,2021,N/A,10 Dec 2021,84 min,Comedy,Stephanie Koenig,Stephanie Koenig,"Brian Jordan Alvarez, Michael Benjamin, Edgar Blackmon","'A Spy Movie' is an action comedy/parody. Stephanie Koenig, Brian Jordan Alvarez, and Brian Jordan Alvarez star in the film as the maniacal evil-doer Evelina, and the two spies desperate to stop her, Jack Johnson and Bushilla Stra...",English,United States,N/A,https://m.media-amazon.com/images/M/MV5BNmQ3MTQ0OWYtMjU2MC00N2QzLWE5ZGEtZTA4NTA0MmE1ODhkXkEyXkFqcGdeQXVyMjIyNDkyODk@._V1_SX300.jpg,[],N/A,N/A,65,tt16867902,movie,N/A,N/A,N/A,N/A,True,
Deadpool Movie in Lego,2021,Not Rated,07 Apr 2021,108 min,"Animation, Action, Adventure",Huxley Berg,N/A,"Karan Soni, Michael Benyaer, Stefan Kapicic","A shot-for-shot remake of the 2016 movie, Deadpool, created entirely out of Lego.",English,United States,N/A,https://m.media-amazon.com/images/M/MV5BMjU2MmI5MjItNzc3ZC00NDgwLTkyMWEtNWMwMmUyMDg1OWZkXkEyXkFqcGdeQXVyNzEwMzUxMzU@._V1_SX300.jpg,"[{'Source': 'Internet Movie Database', 'Value': '8.5/10'}]",N/A,8.5,64,tt13414858,movie,N/A,N/A,N/A,N/A,True,
